Relaiskontakt;r ɛ l ɛ ʔ ɪ s k ɔ n t a k t
Reliefpfeiler;r eː l iː f p f aɪ l ɐ
Religion;r e l i ɡ j oː n
Religionswissenschaft;r e l i ɡ j oː n s v ɪ s ə n ʃ a f t
Reling;r eː l ɪ ŋ
Reliquiar;r e l i k v i a r
Reliquienschrein;r e l i k v j ə n ʃ r aɪ n
Remise;r ə m iː z ə
Remis;r e m ɪ s
Renderer;r ɛ n d ə r ɐ
Renegat;r eː n ə ɡ aː t
Renner;r ɛ n ɐ
Rennpferd;r ɛ n p f ɐ t
Rennradfahrerin;r ɛ n r aː t f aː r ə r ɪ n
Rennradfahrer;r ɛ n r aː t f aː r ɐ
Renovierung;r e n o v iː r ʊ ŋ
Rentenmarkt;r ɛ n t ə n m a r k t
Rentier;r ɛ n t iː ə
Replik;r e p l ɪ k
Reporterin;r e p ɔɐ t ə n r ɪ n
Reporter;r e p ɔɐ t ɐ
Report;r e p oːɐ r t
Repräsentant;r e p r ɛ z ɛ n t a n t
Repressor;r e p r ɛ s ɔ r
Republikflüchtling;r e p u b l iː k f l ʏ ç t l ɪ ŋ
Republikflucht;r e p u b l iː k f l ʊ x t
Republik;r e p u b l iː k
Requiemhai;r e k v iː m h aː
Requiem;r e k v iː m
Requirierung;r ə k v i r iː r ʊ ŋ
Requisition;r ɪ k v i z i ts j oː n
Reserverad;r ɪ z ɐ v eː r a t
Reservereifen;r ɪ z ɐ f ɐ ʔ aɪ f ə n
Resonanz;r e z o n a n ts
Resonator;r e z o n aː t ɔ r
Restaurator;r ɛ s t aʊ r a t ɔ r
Restbetrag;r ɛ s t b ə t r aː k
Reststoff;r ɛ s t ʃ t ɔ f
Resultat;r e z ʊ l t aː t
Retrospektive;r eː t r ɔ s p ɛ k t iː v ə
Retter;r ɛ t ɐ
Rettich;r ɛ t ɪ ç
Rettung;r ɛ t ʊ ŋ
Rettungsboot;r ɛ t ʊ ŋ s b oː t
Rettungshubschrauber;r ɛ t ʊ ŋ s h uː p ʃ r aʊ b ɐ
Rettungsring;r ɛ t ʊ ŋ s r ɪ ŋ
Rettungsweg;r ɛ t ʊ ŋ s v eː k
Rettungszeichen;r ɛ t ʊ ŋ s ts aɪ ç ə n
Reue;r ɔʏ ə
Reuse;r ɔʏ z ə
Revolution;r e v o l u ts j oː n
Revolverheldin;r ɪ v ɔ l v ɐ h ɛ l d ɪ n
Revolverheld;r ɪ v ɔ l v ɐ h ɛ l t
Rezension;r eː ts ɛ n z j oː n
Rezept;r e ts ɛ p t
Rezeptur;r e ts ɛ p t uːɐ
Rezitativ;r e ts i t aː t iː f
Rhabarber;r h aː b aː r b ɐ
Rhabdomyopathie;r h aː p d o m j o p aː t iː
Rhenium;r e n j ʊ m
Rhetorik;r e t o r ɪ k
Rheumatismus;r ɔʏ m aː t ɪ s m ʊ s
Rhodamin;r h n d a m iː n
Rhodanid;r h o d a n ɪ t
Rhodinieren;r h o d i n iː r ə n
Rhodiumion;r h oː d j ʊ m j ɔ n
Rhodiumisotop;r h oː d j ʊ m i z o t oː p
Rhodiumkatalysator;r h oː d j ʊ m k aː t a l y z a t ɔ r
Rhodiumkomplex;r h oː d j ʊ m k ɔ m p l ɛ k s
Rhodiummineral;r h oː d j ʊ m i n e r aː l
Rhodium;r h oː d j ʊ m
Rhodochrosit;r h oː d ɔ x r o z iː t
Rhodonit;r h o d o n ɪ t
Rho;r h oː
Rhythmik;r ʏ t m ɪ k
Ribonukleotid;r i b oː n u k l e o t iː t
Richter;r ɪ ç t ɐ
Richtlinie;r ɪ ç t l iː n j ə
Riechkolben;r iː ç k ɔ l b ə n
Riechstoff;r iː k ʃ t ɔ f
Riedel;r iː d ə l
Riefe;r iː f ə
Riegel;r iː ɡ ə l
Riesenalk;r iː z ə n aː l k
Riesenkalmar;r iː z ə n k a l m a r
Riesenstern;r iː z ə n ʃ t ɐ n
Riesenwildschaf;r iː z ə n v ɪ l t ʃ aː f
Riesling;r iː s l ɪ ŋ
Rille;r ɪ l ə
Rinderbraten;r ɪ n d ɐ b r aː t ə n
Rinde;r ɪ n d ə
Rind;r ɪ n t
Ringelblume;r ɪ ŋ ə l b l uː m ə
Ringelnatter;r ɪ ŋ ə l n a t ɐ
Ringeltaube;r ɪ ŋ ə l t aʊ b ə
Ringfinger;r ɪ ŋ f ɪ ŋ ɐ
Ringkämpfer;r ɪ ŋ k ɛ m p f ɐ
Rinne;r ɪ n ə
Rippe;r ɪ p ə
Risiko;r iː z i k o
Riss;r ɪ s
Ritter;r ɪ t ɐ
Ritt;r ɪ t
Ritual;r i t u aː l
Ritus;r iː t ʊ s
Ritze;r ɪ t s ə
Robbe;r ɔ b ə
Robe;r oː b ə
Roboter;r ɔ b oː t ɐ
Robustheit;r o b ʊ s t h aɪ t
Rochade;r ɔ x aː d ə
Rochen;r ɔ x ə n
Roentgenium;r oː ə n t ɡ ə n j ʊ m
Roggenfeld;r ɔ ɡ ə n f ɛ l t
Roggenvollkornbrot;r ɔ ɡ ə n f ɔ l k ɔɐ n t b r oː t
Rohling;r oː l ɪ ŋ
Rohprodukt;r oː p r o d ʊ k t
Röhrchen;r øːɐ ç ə n
Röhrenspinne;r øː r ə n ʃ p ɪ n ə
Röhre;r øː r ə
Rohrkatze;r oː r k a t s ə
Rohr;r oːɐ
Rohstoff;r oː ʃ t ɔ f
Rollbahn;r ɔ l b aː n
Rollenspiel;r ɔ l ə n ʃ p iː l
Rollfähre;r ɔ l f ɛː r ə
Rolltreppe;r ɔ l t r ɛ p ə
Romanistin;r o m a n ɪ s t ɪ n
Romanist;r o m a n ɪ s t
Römer;r øː m ɐ
Rondell;r ɔ n d ɛ l
Röntgenfilm;r œ n t ɡ ə n f ɪ l m
Röntgenspektrum;r œ n t ɡ ə n ʃ p ɛ k t r ʊ m
Röntgenstrahl;r œ n t ɡ ə n ʃ t r aː l
Rooibos;r u i b o s
Roquesit;r oː k v eː z ɪ t
Rosenkohl;r oː z ə n k oː l
Rosenkranz;r oː z ə n k r a n ts
Rosenkrieg;r oː z ə n k r iː k
Rosinenkuchenmodell;r o z iː n ə n k uː x ə n m o d ɛ l
Rosinenkuchenrezept;r o z iː n ə n k uː x ə n r e ts ɛ p t
Rosinenkuchen;r o z iː n ə n k uː x ə n
Rosine;r o z iː n ə
Röster;r œ s t ɐ
Rostflügel-Ameisenwürger;r ɔ s t f l yː ɡ ə l ʔ aː m aɪ z ə n v yː r ɡ ɐ
Rostkatze;r ɔ s t k a t s ə
Rostschutzmittel;r ɔ s t ʃ ʊ t s m ɪ t ə l
Rostschutz;r ɔ s t ʃ ʊ t s
Rotbarsch;r oː t b aː r ʃ
Roteisenstein;r o t e i z ə n ʃ t aɪ n
Röte;r øː t ə
Rotfuchs;r oː t f ʊ k s
Rotfußralle;r oː t f ʊ s r a l ə
Rotgültigerz;r ɔ t ɡ ʏ l t ɪ ɡ ɐ ts
Rotguss;r ɔ t ɡ ʊ s
Rothaarige;r oː t aː r ɪ ɡ ə
Röthe;r œ t ə
Rotkehlchen;r oː t k eː l ç ə n
Rotkohl;r oː t k oː l
Rotkopf;r ɔ t k ɔ p f
Rotlichtbezirk;r oː t l ɪ ç t b ə ts i r k
Rotrückenwürger;r oː t r ʏ k ə n v yː r ɡ ɐ
Rotscheitelreiher;r oː t ʃ aɪ t ə l r aɪ ɐ
Rotschopf;r oː t ʃ ɔ p f
Rotte;r ɔ t ə
Rotwein;r oː t v aɪ n
Rotzigkeit;r ɔ t s ɪ ç k aɪ t
Rotzinkerz;r ɔ t s ɪ ŋ k ɐ ts
Rotz;r ɔ t s
RSS-Feed;ʔ ɛ r ʔ ɛ s ʔ ɛ s f eː t
Rubel;r uː b ə l
Rubidiumisotop;r u b iː d j ʊ m i z o t oː p
Rubidiumsalz;r u b iː d j ʊ m z a l ts
Rubiklin;r ʊ b iː k l iː n
Rubin;r uː b iː n
Rückblende;r ʏ k b l ɛ n d ə
Rückblick;r ʏ k b l ɪ k
Rückeroberung;r ʏ k ɐ o b ə r ʊ ŋ
Rückfahrkarte;r ʏ k f aː r k a r t ə
Rückgabe;r ʏ k ɡ aː b ə
Rückgang;r ʏ k ɡ a ŋ
Rückkauf;r ʏ k k aʊ f
Rücklage;r ʏ k l aː ɡ ə
Rücklauf;r ʏ k l aʊ f
Rückmeldung;r ʏ k m ɛ l d ʊ ŋ
Rücknahme;r ʏ k n aː m ə
Ruck;r ʊ k
Rückruf;r ʏ k r uː f
Rucksack;r ʊ k z a k
Rückschluss;r ʏ k ʃ l ʊ s
Rückseite;r ʏ k z aɪ t ə
Rücksicht;r ʏ k z ɪ ç t
Rückspiegel;r ʏ k ʃ p iː ɡ ə l
Rücksprung;r ʏ k ʃ p r ʊ ŋ
Rückstand;r ʏ k ʃ t a n t
Rückstrahler;r ʏ k ʃ t r aː l ɐ
Rücktrittbremse;r ʏ k t r ɪ t b r ɛ m z ə
Rücktritt;r ʏ k t r ɪ t
Rückumlaut;r ʏ k uː m l aʊ t
Rückumschlag;r ʏ k ʊ m ʃ l aː k
Rückwärtsgang;r ʏ k v ɛɐ t s ɡ a ŋ
Rückweg;r ʏ k v eː k
Rudel;r uː d ə l
Ruder;r uː d ɐ
Rufmord;r uː f m oːɐ r t
Ruf;r uː f
Rüge;r yː ɡ ə
Ruhepotential;r uː ə p o t ə n ts j aː l
Ruhestörung;r uː ɛ s t øː r ʊ ŋ
Ruhetag;r uː ə t aː k
Rührei;r yːɐ ʔ aɪ
Ruhr;r uːɐ
Rumäne;r uː m ɛː n ə
Rumänin;r u m ɛː n ɪ n
Rummel;r ʊ m ə l
Rumpf;r ʊ m p f
Rundbrief;r ʊ n t b r iː f
Rundfunkgerät;r ʊ n t f ʊ ŋ k ɡ ə r ɛː t
Rundgotisch;r ʊ n t ɡ oː t ɪ ʃ
Rundschreiben;r ʊ n t ʃ r aɪ b ə n
Runzel;r ʊ n ts ə l
Rupie;r u p iː
Rüsche;r yː ʃ ə
Rüssel;r ʏ s ə l
Russe;r ʊ s ə
Russin;r ʊ s ɪ n
Ruß;r ʊ s
Rüstung;r ʏ s t ʊ ŋ
Rute;r uː t ə
Ruthenat;r uː t ə n a t
Rutheniridosmin;r uː t ə n i r i d o s m iː n
Rutheniumhalogenid;r uː t e n j ʊ m h a l oː ɡ ə n ɪ d
Rutheniumisotop;r uː t e n j ʊ m i z o t oː p
Rutheniumkatalysator;r uː t e n j ʊ m k aː t a l y z a t ɔ r
Rutheniumkomplex;r uː t e n j ʊ m k ɔ m p l ɛ k s
Ruthenium;r uː t e n j ʊ m
Rutherfordium;r ʊ t ɐ f ɔɐ t t i ʊ m
Saalkirche;z aː l k i r ç ə
Saanenziege;z aː n ə n ts iː ɡ ə
Saatkrähe;z aː t k r ɛː ə
Saat;z aː t
Säbel;z ɛː b ə l
Säbelzahntiger;z ɛː b ɛ l t s aː n t ɪ ɡ ɐ
Sabotage;z a b o t aː ɡ ə
Sachbegriff;z a x b ə ɡ r ɪ f
Sachertorte;z a x ɐ t ɔɐ t ə l
Sache;z a x ə
Sachet;z a x ə t
Sachse;z a k s ə
Sackhüpfen;z a k h ʏ p f ə n
Sadist;z a d ɪ s t
Säer;z ɛː ɐ
Safe;s eː f
Safflorit;z a f l o r ɪ t
Safran;z a f r a n
Sage;z aː ɡ ə
Sägezahn;z ɛː ɡ ə ts aː n
Sahne;z aː n ə
Saibling;z aɪ p l ɪ ŋ
Saitenspiel;z aɪ t ə n ʃ p iː l
Saite;z aɪ t ə
Salafist;z a l a f ɪ s t
Salamander;z a l a m a n d ɐ
Salär;z a l ɐ
Salatteller;z a l aː t t ɛ l ɐ
Salm;z a l m
Salomonenralle;z a l o m o n ə n r a l ə
Salon;z aː l ɔ n
Salpeter;z a l p e t ɐ
Salve;z aː l v ə
Salzgestein;z a l ts ɡ ə ʃ t aɪ n
Salzgletscher;z a l ts ɡ l ɛ t ʃ ɐ
Salzgurke;z a l ts ɡ ʊɐ k ə
Salzlake;z a l ts l aː k ə
Salz;z a l ts
Salzstange;z a l ts ʃ t a ŋ ə
Salzstock;z a l ts ʃ t ɔ k
Salzteig;z a l ts t aɪ k
Salzwasserfisch;z a l ts v a s ɐ f ɪ ʃ
Salzwasser;z a l ts v a s ɐ
Salzwiese;z a l ts v iː z ə
Samarium;z a m aː r j ʊ m
Samarskit;z a m a r s k iː t
Samen;z aː m ə n
Sämling;z ɛ m l ɪ ŋ
Sammelbegriff;z a m ə l b ə ɡ r ɪ f
Sammelwut;z a m ə l v uː t
Sammler;z a m l ɐ
Sammlung;z a m l ʊ ŋ
Samstagabend;z a m s t aː k ʔ aː b ə n t
Samstagmittag;z a m s t aː k m ɪ t aː k
Samstagmorgen;z a m s t aː k m ɔɐ ɡ ə n
Samstagnachmittag;z a m s t aː k n aː x m ɪ t aː k
Samstagvormittag;z a m s t aː k f oːɐ r m ɪ t aː k
Samtente;z a m t ɛ n t ə
Samt;z a m t
Sanatorium;z a n a t oːɐ j ʊ m
Sandboden;z a n t b oː d ə n
Sandguss;z a n t ɡ ʊ s
Sandkatze;z a n t k a t s ə
Sandmann;z a n t m a n
Sandstein;z a n t ʃ t aɪ n
Sandsturm;z a n t s t ʊɐ s m
Sängerfest;z ɛ ŋ ɐ f ɛ s t
Sängerin;z ɛ ŋ ə r ɪ n
Sänger;z ɛ ŋ ɐ
Sangria;z a ŋ ɡ r ɪ a
Sanitäter;z a n i t ɛː t ɐ
Sankra;z a ŋ k r a
San-Marinese;z a n m a r iː n eː z ə
Saphir;z a f ɪ r
Sardelle;z a r d ɛ l ə
Sardine;z a r d iː n ə
Sarg;z a r k
Sarkophag;z ɛ r k ɔ f aː k
Satanist;z a t a n ɪ s t
Satire;z a t i r ə
Sattelpunkt;z a t ə l p ʊ ŋ k t
Sattler;z a t l ɐ
Satyr;z a t yː r
Satzzeichen;z a t s t s aɪ ç ə n
Sauberfrau;z aʊ b ɐ f r aʊ
Saubermann;z aʊ b ɐ m a n
Säuberung;z ɔʏ b ə r ʊ ŋ
Sauerampfer;z aʊ ɐ ʔ a m p f ɐ
Sauerbraten;z aʊ ɐ b r aː t ə n
Sauerkirsche;z aʊ ɐ k i ɐ ʃ ə
Sauerstoffanteil;z aʊ ɐ ʃ t ɔ f ʔ a n t aɪ l
Sauerstoffatom;z aʊ ɐ ʃ t ɔ f a t oː m
Sauerstoffdruck;z aʊ ɐ ʃ t ɔ f d r ʊ k
Sauerstoffflasche;z aʊ ɐ ʃ t ɔ f f l a ʃ ə
Sauerstoffgehalt;z aʊ ɐ ʃ t ɔ f ɡ ə h a l t
Sauerstoffisotop;z aʊ ɐ ʃ t ɔ f i z o t oː p
Sauerstoffkreislauf;z aʊ ɐ ʃ t ɔ f k r aɪ s l aʊ f
Sauerstoffmangel;z aʊ ɐ ʃ t ɔ f m a ŋ ə l
Säufer;z ɔʏ f ɐ
Saufgelage;s ʔ aʊ f ɡ ə l aː ɡ ə
Säugling;z ɔʏ k l ɪ ŋ
Saugrohr;z aʊ ɡ r oː r
Saukerl;z aʊ k ɐ l
Säule;z ɔʏ l ə
Saumfarn;z aʊ m f a r n
Sausewind;z aʊ z ə v ɪ n t
Savanne;z a v a n ə
Saxofon;z a k s oː f oː n
Saxophonist;z a k s o f o n ɪ s t
Saxophon;z a k s o f oː n
Scanner;s k ɛ n ɐ
Schabernack;ʃ aː b ɐ n a k
Schabe;ʃ aː b ə
Schablone;ʃ a b l oː n ə
Schabrackenschakal;ʃ a b r a k ə n s ç a k a l
Schachbrett;ʃ a x b r ɛ t
Schachmatt;ʃ a x m ʔ a t
Schachtelhalm;ʃ a x t ə l h a l m
Schachtel;ʃ a x t ə l
Schacht;ʃ a x t
Schädelknochen;ʃ ɛː d ə l k n ɔ x ə n
Schädel;ʃ ɛː d ə l
Schadensersatz;ʃ aː d ə n z ɐ z a t s
Schade;ʃ aː d ə
Schädigung;ʃ ɛː d ɪ ɡ ʊ ŋ
Schädlingsbekämpfungsmittel;ʃ ɛː t l ɪ ŋ s b ə k ɛ m p f ʊ ŋ s m ɪ t ə l
Schädling;ʃ ɛː t l ɪ ŋ
Schadstoff;ʃ aː t ʃ t ɔ f
Schäfchen;ʃ ɛ f ç ə n
Schäferhund;ʃ ɛː f ɐ h ʊ n t
Schäferin;ʃ ɛː f ɐ ʔ ɪ n
Schäfer;ʃ ɛː f ɐ
Schaffleisch;ʃ a f l aɪ ʃ
Schaffnerin;ʃ a f n ə r ɪ n
Schaffner;ʃ a f n ɐ
Schafgarbe;ʃ a f ɡ a r b ə
Schafhirte;ʃ aː f h ɪ r t ə
Schakal;ʃ a k a l
Schalenmodell;ʃ aː l ə n m o d ɛ l
Schalentier;ʃ a l ə n t iː ə
Schale;ʃ aː l ə
Schalldichte;ʃ a l d ɪ ç t ə
Schalmei;ʃ a l m aɪ
Schalotte;ʃ a l ɔ t ə
Schal;ʃ aː l
Schalter;ʃ a l t ɐ
Schalthebel;ʃ a l t h eː b ə l
Schaltkreis;ʃ a l t k r aɪ s
Schalttag;ʃ a l t t aː k
Schaltung;ʃ a l t ʊ ŋ
Schaltwerk;ʃ a l t v ɐ k
Schaluppe;ʃ aː l ʊ p ə
Schamentzündung;ʃ a m ə n t t s ʏ n d ʊ ŋ
Schamhaar;ʃ aː m h aː r
Scham;ʃ a m
Schandblatt;ʃ a n t b l a t
Schande;ʃ a n d ə
Schänke;ʃ ɛ ŋ k ə
Schanktisch;ʃ a ŋ k t ɪ ʃ
Scharade;ʃ aː r a d ə
Scharbockskraut;ʃ a r b ɔ k s k r aʊ t
Schärfe;ʃ ɛɐ f ə
Scharlach;ʃ a r l a x
Scharmützel;ʃ a r m ʏ t s ə l
Scharnier;ʃ a r n iː ə
Schaschlik;ʃ a ʃ l ɪ k
Schattenmorelle;ʃ a t ə n m o r ɛ l ə
Schatten;ʃ a t ə n
Schattenspiel;ʃ a t ə n ʃ p iː l
Schätzchen;ʃ ɛ t s ç ə n
Schatz;ʃ a t s
Schaubühne;ʃ aʊ p yː n ə
Schauer;ʃ aʊ ɐ
Schaufensterbummel;ʃ aʊ f ɛ n s t ɐ b ʊ m ə l
Schaufenster;ʃ aʊ f ɛ n s t ɐ
Schaufensterscheibe;ʃ aʊ f ɛ n s t ɐ ʃ aɪ b ə
Schaukelpferd;ʃ aʊ k ə l p f eːɐ t
Schaukel;ʃ aʊ k ə l
Schaum;ʃ aʊ m
Schauplatz;ʃ aʊ p l a t s
Schauspielerei;ʃ aʊ ʃ p iː l ə r aɪ
Schauspieler;ʃ aʊ ʃ p iː l ɐ
Schauspiel;ʃ aʊ ʃ p iː l
Scheck;ʃ ɛ k
Scheffel;ʃ ɛ f ə l
Scheibchen;ʃ aɪ p ç ə n
Scheibenbremse;ʃ aɪ b ə n b r ɛ m z ə
Scheibenwischer;ʃ aɪ b ə n v ɪ ʃ ɐ
Scheibe;ʃ aɪ b ə
Scheich;ʃ aɪ ç
Scheide;ʃ aɪ d ə
Scheideweg;ʃ aɪ d ə v eː k
Scheinbuche;ʃ aɪ n b uː x ə
Scheinsieg;ʃ aɪ n z iː k
Scheinwerfer;ʃ aɪ n v ɛɐ f ɐ
Scheißdreck;ʃ aɪ s d r ɛ k
Scheißerei;ʃ aɪ s ə r aɪ
Scheißkerl;ʃ aɪ s k ɐ l
Scheitelpunkt;ʃ aɪ t ə l p ʊ ŋ k t
Scheitel;ʃ aɪ t ə l
Scheitern;ʃ aɪ t ɐ n
Schellente;ʃ ɛ l ə n t ə
Schellfisch;ʃ ɛ l f ɪ ʃ
Schelm;ʃ ɛ l m
Schemel;ʃ eː m ə l
Schenkel;ʃ ɛ ŋ k ə l
Schenke;ʃ ɛ ŋ k ə
Scherbe;ʃ ɐ b ə
Schere;ʃ eː r ə
Scherge;ʃ ɐ ɡ ə
Scherz;ʃ ɛɐ ts
Scheune;ʃ ɔʏ n ə
Schicht;ʃ ɪ ç t
Schicksal;ʃ ɪ k z aː l
Schickse;ʃ ɪ k z ə
Schiefer;ʃ iː f ɐ
Schiege;ʃ iː ɡ ə
Schienenersatzverkehr;ʃ iː n ə n ɐ z a t s f ɐ k eː r
Schiene;ʃ iː n ə
Schießbefehl;ʃ iː s b ə f eː l
Schießgewehr;ʃ iː s ɡ ə v eː r
Schießpulver;ʃ iː ʃ p ʊ l v ɐ
Schiffahrt;ʃ ɪ f aː r t
Schifffahrt;ʃ ɪ f f aː r t
Schiffshebewerk;ʃ ɪ f s h eː b ə v ɐ k
Schiffskörper;ʃ ɪ f s k œɐ b p ɐ
Schiffsrumpf;ʃ ɪ f s r ʊ m p f
Schiffstaufe;ʃ ɪ f s t ʔ aʊ f ə
Schiffsverkehr;ʃ ɪ f s f ɐ k eː r
Schilddrüsenhormon;ʃ ɪ l t d r yː z ɛ n h ɔɐ m a o n
Schildkrebs;ʃ ɪ l t k r eː p s
Schildkröte;ʃ ɪ l t k r øː t ə
Schildlaus;ʃ ɪ l t l aʊ s
Schilf;ʃ ɪ l f
Schill;ʃ ɪ l
Schimäre;ʃ i m ɛː r ə
Schimmelpilz;ʃ ɪ m ə l p ɪ l ts
Schimmer;ʃ ɪ m ɐ
Schimpanse;ʃ ɪ m p a n z ə
Schinken;ʃ ɪ ŋ k ə n
Schippe;ʃ ɪ p ə
Schirmfrau;ʃ i r m f r aʊ
Schirmherr;ʃ ɪɐ m h ɛɐ
Schisser;ʃ ɪ s ɐ
Schlachter;ʃ l a x t ɐ
Schlächter;ʃ l ɛ ç t ɐ
Schlachtfeld;ʃ l a x t f ɛ l t
Schlachtschiff;ʃ l a x t ʃ ɪ f
Schlacke;ʃ l a k ə
Schlafanzug;ʃ l aː f ʔ a n ts uː k
Schläfchen;ʃ l ɛː f ç ə n
Schlafentzug;ʃ l aː f ə n t t s uː k
Schläfer;ʃ l ɛː f ɐ
Schläfe;ʃ l ɛː f ə
Schlaflied;ʃ l aː f l iː t
Schlaflosigkeit;ʃ l aː f l oː z ɪ ç k aɪ t
Schlafmittel;ʃ l aː f m ɪ t ə l
Schlafmütze;ʃ l aː f m ʏ t s ə
Schlafsaal;ʃ l aː f z aː l
Schlafstörung;ʃ l aː f s t øː r ʊ ŋ
Schlaftablette;ʃ l aː f t ʔ a p l ɛ t ə
Schlafwandler;ʃ l aː f v a n d l ɐ
Schlagbaum;ʃ l aː k b aʊ m
Schlager;ʃ l aː ɡ ɐ
Schläger;ʃ l ɛː ɡ ɐ
Schlagmann;ʃ l aː k m a n
Schlagsahne;ʃ l aː k z aː n ə
Schlagzeuger;ʃ l aː k ts ɔʏ ɡ ɐ
Schlamm;ʃ l a m
Schlange;ʃ l a ŋ ə
Schlaraffenland;ʃ l a r a f ə n l a n t
Schlauchboot;ʃ l aʊ x b oː t
Schlaumeier;ʃ l ʔ aʊ m aɪ ɐ
Schlegel;ʃ l eː ɡ ə l
Schleiereule;ʃ l aɪ ə r ɔʏ l ə
Schleier;ʃ l aɪ ɐ
Schleife;ʃ l aɪ f ə
Schleifring;ʃ l aɪ f r ɪ ŋ
Schleimhaut;ʃ l aɪ m h aʊ t
Schleim;ʃ l aɪ m
Schlepper;ʃ l ɛ p ɐ
Schleppe;ʃ l ɛ p ə
Schlesier;ʃ l ə z iː ə
Schleuse;ʃ l ɔʏ z ə
Schlick;ʃ l ɪ k
Schließfach;ʃ l iː s f a x
Schlingel;ʃ l ɪ ŋ ə l
Schlinge;ʃ l ɪ ŋ ə
Schlittenfahrt;ʃ l ɪ t ə n f aː r t
Schlitten;ʃ l ɪ t ə n
Schlittschuh;ʃ l ɪ t ʃ uː
Schlitz;ʃ l ɪ t s
Schlosser;ʃ l ɔ s ɐ
Schloss;ʃ l ɔ s
Schlot;ʃ l oː t
Schlucht;ʃ l ʊ x t
Schluff;ʃ l ʊ f
Schlummer;ʃ l ʊ m ɐ
Schlumpf;ʃ l ʊ m p f
Schlüpfer;ʃ l ʏ p f ɐ
Schlupfwinkel;ʃ l ʊ p f v ɪ ŋ k ə l
Schlüsselbein;ʃ l ʏ s ə l b aɪ n
Schlüsselrolle;ʃ l ʏ s ə l r ɔ l ə
Schlussleuchte;ʃ l ʊ s l ɔʏ ç t ə
Schlusspfiff;ʃ l ʊ s s p f ɪ f
Schluss;ʃ l ʊ s
Schluß;ʃ l ʊ s
Schmach;ʃ m a x
Schmand;ʃ m a n t
Schmarotzer;ʃ m ʔ a r ɔ t s ɐ
Schmaus;ʃ m aʊ s
Schmeichelei;ʃ m aɪ ç ə l aɪ
Schmelzbad;ʃ m ɛ l ts b aː t
Schmelzen;ʃ m ɛ l ts ə n
Schmelze;ʃ m ɛ l ts ə
Schmelzprozess;ʃ m ɛ l ts p r o t s ɛ s
Schmelzpunkt;ʃ m ɛ l ts p ʊ ŋ k t
Schmelz;ʃ m ɛ l ts
Schmelzwärme;ʃ m ɛ l ts v ɐ m ə
Schmerle;ʃ m ɐ l ə
Schmerzmittel;ʃ m ɐ ts m ɪ t ə l
Schmiedeeisen;ʃ m iː d ə ʔ aɪ z ə n
Schmiedin;ʃ m iː d ɪ n
Schmierblatt;ʃ m iː r p l a t
Schmierfett;ʃ m iː r f ɛ t
Schmieröl;ʃ m iː r ʔ øː l
Schmierpapier;ʃ m iː r p a p iː ə
Schmierstoff;ʃ m iː r ʃ t ɔ f
Schmierzettel;ʃ m iː r ts ɛ t ə l
Schmirgelpapier;ʃ m ɪ r ɡ ɛ l p a p iː ə
Schmuck;ʃ m ʊ k
Schmuckstein;ʃ m ʊ k ʃ t aɪ n
Schmuggler;ʃ m ʊ ɡ l ɐ
Schmutz;ʃ m ʊ t s
Schnabelwal;ʃ n aː b ə l v a l
Schnake;ʃ n aː k ə
Schnalle;ʃ n a l ə
Schnäppchen;ʃ n ɛ p ç ə n
Schnarchralle;ʃ n a r ç r a l ə
Schnauzer;ʃ n aʊ ts ɐ
Schnäuzer;ʃ n ɔʏ ts ɐ
Schnauze;ʃ n aʊ ts ə
Schneckentempo;ʃ n ɛ k ə n t ɛ m p o
Schneeblindheit;ʃ n eː ə b l ɪ n t h aɪ t
Schneefall;ʃ n eː f a l
Schneeglöckchen;ʃ n eː ɡ l œ k ç ə n
Schneekanone;ʃ n eː k a n oː n ə
Schneemann;ʃ n ə ʔ ɛ m a n
Schneepflug;ʃ n iː p f l uː k
Schneeräumer;ʃ n eː r ɔʏ m ɐ
Schneeschaf;ʃ n eː ʃ a f
Schneeziege;ʃ n eː ts iː ɡ ə
Schneidbrett;ʃ n aɪ t b r ɛ t
Schneiderkreide;ʃ n aɪ d ɐ k r aɪ d ə
Schneiderlein;ʃ n aɪ d ɐ l aɪ n
Schneider;ʃ n aɪ d ɐ
Schneide;ʃ n aɪ d ə
Schneidwerkzeug;ʃ n aɪ t v ɐ k ts ɔʏ k
Schnellkochtopf;ʃ n ɛ l k ɔ x t ɔ p f
Schnellspanner;ʃ n ɛ l ʃ p a n ɐ
Schnepfe;ʃ n ɛ p f ə
Schniedel;ʃ n iː d ə l
Schnipsel;ʃ n ɪ p s ə l
Schnittbrot;ʃ n ɪ t t b r oː t
Schnittlauch;ʃ n ɪ t l aʊ x
Schnittstellenbeschreibungssprache;ʃ n ɪ t ʃ t ɛ l ə n b ə ʃ r aɪ b ʊ ŋ s ʃ p r aː x ə
Schnittstellendefinitionssprache;ʃ n ɪ t ʃ t ɛ l ə n d e f i n i ts j oː n s ʃ p r aː x ə
Schnittstelle;ʃ n ɪ t ʃ t ɛ l ə
Schnitzeljagd;ʃ n ɪ t s ə l j aː k t
Schnitzel;ʃ n ɪ t s ə l
Schnitzer;ʃ n ɪ t s ɐ
Schnorchel;ʃ n ɔɐ r ç ə l
Schnörkellosigkeit;ʃ n œɐ k ə l l oː z ɪ ç k aɪ t
Schnuckel;ʃ n ʊ k ə l
Schnupfen;ʃ n ʊ p f ə n
Schnurrbart;ʃ n u r b a r t
Schnürsenkel;ʃ n ʔ yː r z ɛ ŋ k ə l
Schnute;ʃ n u t ə
Schober;ʃ oː b ɐ
Schöffe;ʃ øː f ə
Schokoladenfabrik;ʃ o k o l aː d ə n f a b r iː k
Schokoladenkuchen;ʃ o k o l aː d ə n k uː x ə n
Schokolade;ʃ o k o l aː d ə
Scholle;ʃ ɔ l ə
Schoner;ʃ ɔ n ɐ
Schönheitsfehler;ʃ øː n h aɪ t s f eː l ɐ
Schönling;ʃ øː n l ɪ ŋ
Schönredner;ʃ øː n r ɛ t n ɐ
Schonungslosigkeit;ʃ oː n ʊ ŋ s l oː z ɪ ç k aɪ t
Schöpfer;ʃ œ p f ɐ
Schöpfkelle;ʃ œ p f k ɛ l ə
Schöpflöffel;ʃ œ p f l œ f ə l
Schopfpinguin;ʃ o p f p ɪ ŋ ɡ u ɪ n
Schopf;ʃ ɔ p f
Schöpfung;ʃ œ p f ʊ ŋ
Schöpfungstag;ʃ œ p f ʊ ŋ s t aː k
Schorf;ʃ h ɔɐ f
Schornsteinfegerin;ʃ h ɔɐ n ʃ t aɪ n f ə ɡ ə r ɪ n
Schornsteinfeger;ʃ ɔɐ n ʃ t aɪ n f eː ɡ ɐ
Schoß;ʃ ɔ s
Schote;ʃ oː t ə
Schotte;ʃ ɔ t ə
Schottin;ʃ ɔ t iː n
Schott;ʃ ɔ t
Schrägstrich;ʃ r ɛː k ʃ t r ɪ ç
Schranke;ʃ r a ŋ k ə
Schrank;ʃ r a ŋ k
Schraube;ʃ r aʊ b ə
Schreckensherrschaft;ʃ r ɛ k ə n s h ɛ r ʃ a f t
Schrecke;ʃ r ɛ k ə
Schreiben;ʃ r aɪ b ə n
Schreiber;ʃ r aɪ b ɐ
Schreibfeder;ʃ r aɪ p f eː d ɐ
Schreibsekretär;ʃ r aɪ p s ə k r e t ɐ
Schreibtischtäter;ʃ r aɪ p t ɪ ʃ t ɛː t ɐ
Schreibung;ʃ r aɪ b ʊ ŋ
Schreinerei;ʃ r aɪ n ə r aɪ
Schreiner;ʃ r aɪ n ɐ
Schrein;ʃ r aɪ n
Schrei;ʃ r aɪ
Schrifft;ʃ r ɪ f t
Schriftrolle;ʃ r ɪ f t r ɔ l ə
Schrittgeschwindigkeit;ʃ r ɪ t ɡ ə ʃ v ɪ n d ɪ ç k aɪ t
Schritttempo;ʃ r ɪ t t ɛ m p o
Schritt-Tempo;ʃ r ɪ t t ɛ m p o
Schrotflinte;ʃ r ɔ t f l ɪ n t ə
Schrot;ʃ r oː t
Schrottanleihe;ʃ r ɔ t aː n l aɪ ə
Schrott;ʃ r ɔ t
Schubkarren;ʃ uː p k a r ə n
Schubkarre;ʃ uː p k a r ə
Schub;ʃ uː p
Schubs;ʃ ʊ p s
Schuft;ʃ ʊ f t
Schuhlöffel;ʃ ʊ l œ f ə l
Schulbuch;ʃ uː l b uː x
Schulbuchverlag;ʃ uː l b uː x f ɐ l aː k
Schuldenschnitt;ʃ ʊ l d ə n ʃ n ɪ t
Schuldner;ʃ ʊ l d n ɐ
Schuldschein;ʃ ʊ l t ʃ aɪ n
Schuldsumme;ʃ ʊ l t z ʊ m ə
Schuldvertrag;ʃ ʊ l t v ɐ t r aː k
Schülerin;ʃ yː l ə r ɪ n
Schüler;ʃ yː l ɐ
Schulkind;ʃ uː l k ɪ n t
Schulleiterin;ʃ uː l l aɪ t ə r ɪ n
Schulleiter;ʃ uː l l aɪ t ɐ
Schulnote;ʃ uː l n oː t ə
Schulterblatt;ʃ ʊ l t ɐ b l a t
Schulzeit;ʃ uː l ts aɪ t
Schulze;ʃ ʊ l ts ə
Schummelei;ʃ ʊ m ə l aɪ
Schüppe;ʃ ʏ p ə
Schürze;ʃ ʏɐ ts ə
Schüssel;ʃ ʏ s ə l
Schusswaffe;ʃ ʊ s v a f ə
Schusswechsel;ʃ ʊ s v ɛ k s ə l
Schutzblech;ʃ ʊ t s b l ɛ ç
Schützenfisch;ʃ ʏ t s ə n f ɪ ʃ
Schutzengel;ʃ ʊ t s ə n ɡ ə l
Schützengraben;ʃ ʏ t s ə n ɡ r aː b ə n
Schutzgas;ʃ ʊ t s ɡ a s
Schutzmann;ʃ ʊ t s m a n
Schutzschirm;ʃ ʊ t s ʃ i r m
Schütz;ʃ ʏ t s
Schutzwall;ʃ ʊ t s v a l
Schwabe;ʃ v aː b ə
Schwächegefühl;ʃ v ɛ ç ə ɡ ə f yː l
Schwäche;ʃ v ɛ ç ə
Schwachkopf;ʃ v a x k ɔ p f
Schwächling;ʃ v ɛ ç l ɪ ŋ
Schwachsinn;ʃ v a x z ɪ n
Schwächung;ʃ v ɛ ç ʊ ŋ
Schwade;ʃ v aː d ə
Schwägerin;ʃ v ɛː ɡ ə r ɪ n
Schwager;ʃ v aː ɡ ɐ
Schwall;ʃ v a l
Schwamm;ʃ v a m
Schwan;ʃ v aː n
Schwänzchen;ʃ v ɛ n ts ç ə n
Schwanzlutscher;ʃ v a n t s l ʊ t ʃ ɐ
Schwanz;ʃ v a n ts
Schwanzstück;ʃ v a n ts ʃ t ʏ k
Schwärmerei;ʃ v ɐ m ə r aɪ
Schwärmerin;ʃ v ɐ m ə r ɪ n
Schwärmer;ʃ v ɐ m ɐ
Schwarm;ʃ v a r m
Schwarte;ʃ v a r t ə
Schwärze;ʃ v ɐ ts ə
Schwarzfußkatze;ʃ v a r ts f uː s k a t s ə
Schwarzgesicht-Ameisenwürger;ʃ v a r ts ɡ ə z ɪ ç t ʔ aː m aɪ z ə n v yː r ɡ ɐ
Schwarzhandel;ʃ v a r ts h a n d ə l
Schwarzkehl-Ameisenwürger;ʃ v a r ts k eː l ʔ aː m aɪ z ə n v yː r ɡ ɐ
Schwarzmasken-Ameisenwürger;ʃ v a r ts m a s k ə n ʔ aː m aɪ z ə n v yː r ɡ ɐ
Schwarzpulver;ʃ v a r ts p ʊ l v ɐ
Schwarzseherei;ʃ v a r ts z eː ʔ iː r aɪ
Schwarzseherin;ʃ v a r ts z eː ʔ iː r ɪ n
Schwarzseher;ʃ v a r ts z eː ʔ iː r
Schwarzwurzel;ʃ v a r ts v t r ts ə l
Schwätzerin;ʃ v ɛ t s ə r ɪ n
Schwätzer;ʃ v ɛ t s ɐ
Schwazer;ʃ v aː ts ɐ
Schwebfliege;ʃ v eː p f l iː ɡ ə
Schwede;ʃ v eː d ə
Schwefeldampf;ʃ v e f ə l t ʔ a m p f
Schwefelhalogenid;ʃ v eː f ə l h a l oː ɡ ə n ɪ d
Schwefeloxid;ʃ v eː f ə l ɔ k s iː t
Schweif;ʃ v aɪ f
Schweigeminute;ʃ v aɪ ɡ ə m i n uː t ə
Schweigen;ʃ v aɪ ɡ ə n
Schweinchen;ʃ v aɪ n ç ə n
Schweinebraten;ʃ v aɪ n ə b r aː t ə n
Schweinehirte;ʃ v aɪ n ə h ɪ r t ə
Schweinehund;ʃ v aɪ n ə h ʊ n t
Schweinepriester;ʃ v aɪ n ə p r iː s t ɐ
Schweinerei;ʃ v aɪ n ə r aɪ
Schweinfurter;ʃ v aɪ n f t r t ɐ
Schweinhund;ʃ v aɪ n h ʊ n t
Schweißdrüse;ʃ v aɪ s d r yː z ə
Schweißen;ʃ v aɪ s ə n
Schweißverfahren;ʃ v aɪ s f ɐ f aː r ə n
Schweizerin;ʃ v aɪ ts ə r ɪ n
Schweizer;ʃ v aɪ ts ɐ
Schwellenwert;ʃ v ɛ l ə n v ɐ t
Schwelle;ʃ v ɛ l ə
Schwellung;ʃ v ɛ l ʊ ŋ
Schwemme;ʃ v ɛ m ə
Schwenkbügel;ʃ v ɛ ŋ k b yː ɡ ə l
Schwerhörigkeit;ʃ v ɐ h øː r ɪ ç k aɪ t
Schwermetallion;ʃ v ɛɐ m øː ə t ʔ a l j oː n
Schwermetall;ʃ v ɛɐ m øː ə t ʔ a l
Schwertmannit;ʃ v ɐ t m a n iː t
Schwertwal;ʃ v ɐ t v a l
Schwester;ʃ v ɛ s t ɐ
Schwiegersohn;ʃ v iː ɡ ɐ z oː n
Schwierigkeit;ʃ v iː r ɪ ç k aɪ t
Schwimmer;ʃ v ɪ m ɐ
Schwirrgerät;ʃ v i r ɡ ə r ɛː t
Schwirrholz;ʃ v i r h ɔ l ts
Schwirrvogel;ʃ v i r f o ɡ ə l
Schwungrad;ʃ v ʊ ŋ r a t
Schwung;ʃ v ʊ ŋ
Schwur;ʃ v uːɐ
Scoop;ʃ uː p
Scratchen;ʃ r a t ç ə n
Screencast;ʃ r eː n k a s t
Seaborgium;z eː a b ɔɐ k ɡ j ʊ m
Sechseck;z ɛ k s ə k
Sechsring;z ɛ k s r ɪ ŋ
Sechs;z ɛ k s
Sedimentgestein;z e d i m ɛ n t ɡ ə ʃ t aɪ n
Sediment;z e d i m ɛ n t
Seeadler;z eː a d l ɐ
Seehafen;z eː h aː f ə n
Seehase;z eː h aː z ə
Seehecht;z eː ʔ ɛ ç t
Seeigel;z eː ʔ aɪ ɡ ə l
Seekiefer;z eː k iː f ɐ
Seekrankheit;z eː ə k r a ŋ k h aɪ t
Seelachs;z eː l a k s
Seele;z eː l ə
Seelöwe;z eː l øː v ə
Seemacht;z ɛ k m a x t
Seemeile;z ɛ k m aɪ l ə
Seeotter;z e oː t ɐ
Seeräuberei;z eː r ɔʏ b ə r aɪ
Seeräuber;z eː r ɔʏ b ɐ
Seerose;z eː r oː z ə
Seeschiff;z eː ʃ ɪ f
Seeschwalbe;z eː ʃ v a l b ə
Seeskorpion;z eː s k ɔɐ b p i oː n
Seestück;z eː ʃ t ʏ k
Seetang;z eː t aː n ɡ
Seetaucher;z eː t aʊ x ɐ
Seewolf;z eː v ɔ l f
Seezunge;z eː ts ʊ ŋ ə
Segelboot;z eː ɡ ə l b oː t
Segelflugzeug;z eː ɡ ə l f l uː k ts ɔʏ k
Segelschiff;z eː ɡ ə l ʃ ɪ f
Segel;z eː ɡ ə l
Segen;z eː ɡ ə n
Segler;z eː ɡ l ɐ
Segner;z eː ɡ n ɐ
Sehen;z eː ə n
Sehenswürdigkeit;z eː ə n s v ʏɐ d ɪ ç k aɪ t
Seher;z eː ʔ iː r
Sehne;z eː n ə
Sehnsucht;z eː n z ʊ x t
Seidenhemd;z aɪ d ə n h ɛ m t
Seidenschwanz;z aɪ d ə n ʃ v a n ts
Seifenoper;z aɪ f ə n oː p ɐ
Seife;z aɪ f ə
Seilbahn;z aɪ l b aː n
Seil;z aɪ l
Sein;z aɪ n
Seinsstufung;z aɪ n s ʃ t uː f ʊ ŋ
Seiteneingang;z aɪ t ə n ʔ aɪ n ɡ a ŋ
Seitenfläche;z aɪ t ə n f l ɛ ç ə
Seitensprung;z aɪ t ə n ʃ p r ʊ ŋ
Sekretariat;z e k r e t a r j aː t
Sekretärin;z e k r e t ɛː r ɪ n
Sekretär;z e k r e t ɛːɐ
Sektor;z ɛ k t oːɐ
Sekundant;z e k ʊ n t ʔ a n t
Sekundenbruchteil;z e k ʊ n d ə n b r ʊ x t aɪ l
Sekundenschlaf;z e k ʊ n d ə n ʃ l aː f
Selan;z ɛ l aː n
