Kragenente;k r aː ɡ ə n ɛ n t ə
Krähe;k r ɛː ə
Krähenfraß;k r ɛː ə n f r aː s
Krake;k r aː k ə
Kralle;k r aː l l ə
Krämer;k r ɛː m ɐ
Kram;k r aː m
Krampfanfall;k r a m p f aː n f a l
Krampf;k r a m p f
Kranbeere;k r ʔ a n b eː r ə
Kranich;k r aː n ɪ ç
Krankenhäuschen;k r a ŋ k ə n h ɔʏ s ç ə n
Krankenpfleger;k r a ŋ k ə n p f l eː ɡ ɐ
Krankenschein;k r a ŋ k ə n ʃ aɪ n
Krankenschwester;k r a ŋ k ə n ʃ v ɛ s t ɐ
Krankenstand;k r a ŋ k ə n ʃ t a n t
Krankheit;k r a ŋ k h aɪ t
Krankheitserreger;k r a ŋ k h aɪ t s ɐ r eː ɡ ɐ
Krankheitsfall;k r a ŋ k h aɪ t s f a l
Kranz;k r a n ts
Krapfen;k r a p f ə n
Kratze;k r a t s ə
Krätze;k r ɛ t s ə
Kratzer;k r a t s ɐ
Krawall;k r a v a l
Krawatte;k r a v a t ə
Kreationistin;k r e a ts j o n ɪ s t ɪ n
Kreationist;k r e a ts j o n ɪ s t
Kreatur;k r e aː t uːɐ ɐ
Krebsarzt;k r eː p s ʔ a r ts t
Krebs;k r eː p s
Krebstier;k r eː p ʃ t iː ə
Kredithai;k r e d ɪ t h aɪ
Kreiselkompass;k r aɪ z ə l k ɔ m p a s
Kreisel;k r aɪ z ə l
Kreislauf;k r aɪ s l aʊ f
Kreislaufstörung;k r aɪ s l aʊ f ʃ t øː r ʊ ŋ
Kreislaufversagen;k r aɪ s l aʊ f f ɐ z aː ɡ ə n
Kreissäge;k r aɪ s z ɛː ɡ ə
Kreistag;k r aɪ s t aː k
Kren;k r eː n
Kresse;k r ɛ s ə
Kretscham;k r ɛ t s ç a m
Kreutz;k r ɔʏ t s
Kreuzbein;k r ɔʏ ts b aɪ n
Kreuzfahrtschiff;k r ɔʏ t s f aː r t ʃ ɪ f
Kreuzschlitzschraube;k r ɔʏ ts ʃ l ɪ t s ʃ r aʊ b ə
Kreuzschlitzschraubendreher;k r ɔʏ ts ʃ l ɪ t s ʃ r aʊ b ə n t r eː ʔ iː r
Kreuzschlitzschraubenzieher;k r ɔʏ ts ʃ l ɪ t s ʃ r aʊ b ə n ts iː h ɐ
Kreuzworträtsel;k r ɔʏ t s v ɔɐ t r ɛː t s ə l
Kreuzzeichen;k r ɔʏ ts ts aɪ ç ə n
Krevette;k r e v ɛ t ə
Kriechtier;k r iː ç t iː ə
Krieger;k r iː ɡ ɐ
Kriegsbemalung;k r iː k s b ə m aː l ʊ ŋ
Kriegsdenkmünze;k r iː k s d ɛ ŋ k m ʏ n ts ə
Kriegsende;k r iː k s ʔ ɛ n d ə
Kriegsschauplatz;k r iː k s ʃ aʊ p l a t s
Kriegsschiff;k r iː k s ʃ ɪ f
Kriegstreiber;k r iː k s t r aɪ b ɐ
Kriegszustand;k r iː k s ts uː ʃ t a n t
Kriminalroman;k r i m i n aː l r ə m aː n
Krippe;k r ɪ p ə
Krise;k r iː z ə
Kristallfeld;k r ɪ s t a l f ɛ l t
Kristallfeldtheorie;k r ɪ s t a l f ə l t t h ɛ o r iː
Kristallit;k r ɪ s t a l iː t
Kristall;k r ɪ s t a l
Kristallsystem;k r ɪ s t a l z ʏ s t eː m
Kriterium;k r i t eːɐ j ʊ m
Kritikerin;k r iː t i k ə r ɪ n
Kritiker;k r iː t ɪ k ɐ
Kroate;k r o aː t ə
Krokodil;k r o k o d iː l
Krokus;k r ɔ k ʊ s
Krone;k r oː n ə
Kronenpinguin;k r oː n ə n p ɪ ŋ ɡ u ɪ n
Kronsbeere;k r ɔ n s b eː r ə
Krönung;k r øː n ʊ ŋ
Kropf;k r ɔ p f
Krücke;k r ʏ k ə
Kruke;k r uː k ə
Krume;k r uː m ə
Krümelchen;k r yː m ə l ç ə n
Krümel;k r yː m ə l
Krüppel;k r ʏ p ə l
Krupp;k r ʊ p
Kruste;k r ʊ s t ə
Krustentier;k r ʊ s t ɛ n t iː ə
Kryolithionit;k r ɪ n l ɪ t j o n iː t
Kryolith;k r ɪ n l ɪ t
Kryostat;k r ɪ s t a t
Kryovulkan;k r ɪ o v ʊ l k aː n
Kryptonion;k r ʏ p t o n j oː n
Kryptonisotop;k r ʏ p t o n i z o t oː p
Kubaralle;k u b a r a l ə
Kubikmeter;k u b iː k m eː t ɐ
Kubikzentimeter;k u b iː k ts ɛ n t i m eː t ɐ
Kuboktaeder;k u b o k t a eː d ɐ
Küche;k ʏ ç ə
Küchengerät;k ʏ ç ə n ɡ ə r ɛː t
Küchenmaschine;k yː ç ə n m a ʃ iː n ə
Küchenmöbel;k ʏ ç ə n m øː b ə l
Küchenreibe;k ʏ ç ə n r aɪ b ə
Kuckuck;k ʊ k ʊ k
Kügelchen;k yː ɡ ə l ç ə n
Kugelfisch;k uː ɡ ə l f ɪ ʃ
Kugelhaufenreaktor;k uː ɡ ə l h aʊ f ə n r e a k t ɔ r
Kugelschnecke;k uː ɡ ə l ʃ n ɛ k ə
Kugelschreiber;k uː ɡ ə l ʃ r aɪ b ɐ
Kugelstoßen;k uː ɡ ə l ʃ t oː s ə n
Kuguar;k uː ɡ u a r
Kühle;k yː l ə
Kühler;k yː l ɐ
Kühlschmierstoff;k yː l ʃ m iː r ʃ t ɔ f
Kühlturm;k yː l t ʊɐ s m
Kuhmilch;k uː m ɪ l ç
Kühnheit;k yː n h aɪ t
Kukuruzkolben;k uː k u r u ts k ɔ l b ə n
Kulanz;k u l a n ts
Kuller;k ʊ l ɐ
Kult;k ʊ l t
Kulturgeschichte;k ʊ l t uːɐ ɡ ə ʃ ɪ ç t ə
Kultur;k ʊ l t uːɐ
Kulturmuslim;k ʊ l t ʊɐ s m ʊ s l ɪ m
Kulturwort;k ʊ l t u r v œɐ t s
Kultusministerium;k ʊ l t ʊ s m i n ɪ s t ə r j ʊ m
Kultusminister;k ʊ l t ʊ s m i n ɪ s t ɐ
Kumane;k uː m aː n ə
Kumanin;k u m a n ɪ n
Kümmel;k ʏ m ə l
Kummerbund;k ʊ m ɐ b ʊ n t
Kumpel;k ʊ m p ə l
Kunstdünger;k ʊ n s t d ʏ ŋ ɐ
Kunstgeschichte;k ʊ n s t ɡ ə ʃ ɪ ç t ə
Kunsthalle;k ʊ n s t h a l ə
Kunsthandwerk;k ʊ n s t h a n t v ɐ k
Künstlerin;k ʏ n s t l ə r ɪ n
Künstler;k ʏ n s t l ɐ
Künstlerroman;k ʏ n s t l ɐ r o m aː n
Künstlichkeit;k ʏ n s t l ɪ ç k aɪ t
Kunstmalerin;k ʊ n s t m aː l ə r ɪ n
Kunstmaler;k ʊ n s t m aː l ɐ
Kunstsprache;k ʊ n s t ʃ p r aː x ə
Kunstspringen;k ʊ n s t ʃ p r ɪ ŋ ə n
Kunststoff;k ʊ n s t ʃ t ɔ f
Kunstwerk;k ʊ n s t v ɛɐ k
Kupfererz;k ʊ p f e r ɐ ts
Kupferkies;k ʊ p f ɐ k iː s
Kupfermünze;k ʊ p f ɐ m ʏ n ts ə
Kupferstich;k ʊ p f ɐ s t ɪ ç
Kuppe;k ʊ p ə
Kupplung;k ʊ p l ʊ ŋ
Kupplungspedal;k ʊ p l ʊ ŋ ʃ p ɛ d aː l
Kürass;k yː r ʔ a s
Kurator;k u r aː t ɔ r
Kurbad;k uːɐ b aː t
Kurbel;k uː r b ə l
Kurbelwelle;k uː r b ə l v ɛ l ə
Kürbiskern;k yː r b ɪ s k ɐ n
Kürbis;k yː r b ɪ s
Kurdin;k ʊɐ s d ɪ n
Kurfürst;k uːɐ f ʏɐ s t
Kurier;k u r iːɐ
Kurkuma;k ʊɐ s k u m a
Kursaal;k ʊɐ s z aː l
Kursbuch;k ʊɐ s b uː x
Kürschnerin;k yː ɐ ʃ n ə r ɪ n
Kürschner;k yː ɐ ʃ n ɐ
Kurs;k ʊɐ s
Kürze;k ʏɐ ts ə
Kurzgeschichte;k ʊɐ ts ɡ ə ʃ ɪ ç t ə
Kurzmitteilung;k ʊɐ ts ts m ɪ t t aɪ l ʊ ŋ
Kurzschluss;k uːɐ t s ʃ l ʊ s
Kurzstreckenlauf;k uːɐ t s ʃ t r ɛ k ə n l aʊ f
Kurzstreckenrakete;k uːɐ t s ʃ t r ɛ k ə n r a k eː t ə
Kurzweil;k ʊɐ ts iː v aɪ l
Kurzzeichen;k ʊɐ ts iː ɪ ç ə n
Kuscheltier;k ʊ ʃ ə l t iː ə
Küsschen;k ʏ s ʃ ə n
Küsserei;k ʏ s ə r aɪ
Küste;k ʏ s t ə
Küstenbereich;k ʏ s t ə n b ə r aɪ ç
Küstengewässer;k ʏ s t ə n ɡ ə v ɛ s ɐ
Küstenregion;k ʏ s t ə n r e ɡ j oː n
Küstenwache;k ʏ s t ə n v a x ə
Küsterin;k ʏ s t ə r ɪ n
Küster;k ʏ s t ɐ
Kutsche;k ʊ t ʃ ə
Kutscher;k ʊ t ʃ ɐ
Kutter;k ʊ t ɐ
Labe;l aː b ə
Laboratorium;l a b oː r a t oː r j ʊ m
Laborgerät;l a b ɔɐ k ɡ ə r ɛː t
Labormaßstab;l a b ɔɐ m a ʔ a s ʃ t a p
Labradorente;l a b r aː d o r ɛ n t ə
Lächerlichkeit;l ɛ ç ɐ l ɪ ç k aɪ t
Lachmöwe;l a x m øː v ə
Lack;l a k
Lactat;l a k t aː t
Lade;l aː d ə
Lader;l eː d ɐ
Ladungsausgleich;l aː d ʊ ŋ s ʔ aʊ s ɡ l aɪ ç
Lage;l aː ɡ ə
Lagerfeuer;l aː ɡ ɐ f ɔʏ ɐ
Lagergefäß;l aː ɡ ɐ ɡ ə f ɛ s
Lagergeld;l aː ɡ ɐ ɡ ɛ l t
Lagerhaus;l aː ɡ ɐ h aʊ s
Lager;l aː ɡ ɐ
Lagerwerkstoff;l aː ɡ ɐ v ɛɐ k a ʃ t ɔ f
Lagune;l aː ɡ uː n ə
Laibchen;l aɪ p ç ə n
Laib;l aɪ p
Laie;l aɪ ə
Lake;l eː k l ɛː n t
Lakritze;l a k r ɪ t s ə
Lambda;l a m p d a
Lambdapunkt;l a m p d a p ʊ ŋ k t
Laminat;l aː m i n a t
Lammbraten;l a m b r aː t ə n
Lämmchen;l ɛ m ç ə n
Lammfellhandschuh;l a m f ɛ l h a n t ʃ uː
Lammfell;l a m f ɛ l
Lampe;l a m p ə
Landestelle;l a n d ə s t ɛ l ə
Landesvater;l a n d ə s f aː t ɐ
Landesverband;l a n d ə s f ɛɐ b a n t
Landesverräterin;l a n d ə s f ɛɐ r ɛː t ə r ɪ n
Landesverräter;l a n d ə s f ɛɐ r ɛː t ɐ
Landesverrat;l a n d ə s f ɛɐ r aː t
Landgericht;l a n tʃ a f t
Landmaschine;l a n t m a ʃ iː n ə
Landrat;l a n t r aː t
Landschaft;l a n t ʃ a f t
Landschaftsgenetik;l a n t ʃ a f t s ɡ e n e t ɪ k
Landstraße;l a n t ʃ t r aː s ə
Landstreicherei;l a n t ʃ t r aɪ ç ə r aɪ
Landstreicherin;l a n t ʃ t r aɪ ç ə r ɪ n
Landstreicher;l a n t ʃ t r aɪ ç ɐ
Landwirtin;l a n t v ɪ r t ɪ n
Landwirt;l a n t v ɪɐ t
Landwirtschaft;l a n t v ɪɐ t ʃ a f t
Länge;l ɛ ŋ ə
Längengrad;l ɛ ŋ ə n ɡ r aː t
Langeweile;l a ŋ ə v aɪ l ə
Langschwanzkatze;l a ŋ ʃ v a n ts k a t s ə
Langschwanzpinguin;l a ŋ ʃ v aː n ts p ɪ ŋ ɡ u ɪ n
Langschwert;l a ŋ ʃ v ɐ t
Langstreckenläufer;l a ŋ s t r ɛ k ə n l ɔʏ f ɐ
Langstreckenrakete;l a ŋ s t r ɛ k ə n r a k eː t ə
Langzeichen;l a ŋ ts aɪ ç ə n
Langzeitarbeitslosigkeit;l a ŋ ts aɪ t ʔ a r b aɪ t s l oː z ɪ ç k aɪ t
Lanthan;l a n t a n
Lanthanoid;l a n t ʔ a n ɔʏ t
Laote;l ɛː ʔ oː ɛ k
Läppchen;l ɛ p b ç ə n
Lappe;l a p ə
Lappenente;l a p ə n ɛ n t ə
Laptop;l ɛ p t ɔ p
Lärche;l ɛɐ r ç ə
Lasche;l a ʃ ə
Läsion;l ɛː z j oː n
Last;l aː s t
Lastschrift;l a s t ʃ r ɪ f t
Latenz;l aː t ɛ n ts
Laterne;l ɔ t ɐ n ə
Latexrock;l aː t ɛ k s r ɔ k
Latrine;l a t r ɪ n ə
Latte;l a t ə
Lätzchen;l ɛ t s ç ə n
Latzhose;l a t s h oː z ə
Latz;l a t s
Laubbaum;l aʊ b aʊ m
Laubbläser;l aʊ b b l ɛː z ɐ
Laubfrosch;l aʊ p f r ɔ ʃ
Laubholz;l aʊ p h ɔ l ts
Laubsturm;l aʊ p s t ʊɐ s m
Laubwald;l aʊ p v a l t
Lauchmotte;l aʊ x m ɔ t ə
Laudanum;l aʊ d a n ʊ m
Laufen;l aʊ f ə n
Lauf;l aʊ f
Laufring;l aʊ f r ɪ ŋ
Laufsteg;l aʊ f ʃ t eː k
Laufvogel;l aʊ f f oː ɡ ə l
Laufwerk;l aʊ f v ɛɐ k
Laufzeit;l aʊ f ts aɪ t
Laune;l aʊ n ə
Laurit;l aʊ r ɪ t
Laus;l aʊ s
Lautenwerck;l aʊ t ə n v ɐ k
Lautmalerei;l aʊ t m aː l ə r aɪ
Lautschrift;l aʊ t ʃ r ɪ f t
Lautwandel;l aʊ t v a n d ə l
Lavendel;l aː v ɛ n d ə l
Lawrencium;l ɛː v r ɛ n ts j ʊ m
Laysanente;l aɪ z a n ɛ n t ə
Lazarett;l a ts a r ɛ t
Lebendgewicht;l eː b ə n t ɡ ə v ɪ ç t
Lebensgröße;l eː b ə n s ɡ r øː s ə
Lebensjahr;l eː b ə n s j aː r
Lebenskraft;l eː b ə n s k r a f t
Lebenslüge;l eː b ə n s l yː ɡ ə
Lebensmittelfarbstoff;l eː b ə n s m ɪ t ə l f a r p ʃ t ɔ f
Lebensmittelhandlung;l eː b ə n s m ɪ t ə l h a n d l ʊ ŋ
Lebensmittelladen;l eː b ə n s m ɪ t ə l l aː d ə n
Lebensmittel;l eː b ə n s m ɪ t ə l
Lebensraum;l eː b ə n s r aʊ m
Lebensweise;l eː b ə n s v aɪ z ə
Lebenswelt;l eː b ə n s v ɛ l t
Lebenszeichen;l eː b ə n s ts aɪ ç ə n
Leberkäse;l eː b ɐ k ɛː z ə
Leber;l eː b ɐ
Leberwurst;l eː b ɐ v ʊɐ s t
Lebewohl;l eː b ə v oː l
Lecker;l ɛ k ɐ
Leck;l ɛ k
Lederhose;l eː d ɐ h oː z ə
Leder;l eː d ɐ
Ledermantel;l eː d ɐ m a n t ə l
Lederstiefel;l eː d ɐ ʃ t iː f ə l
Leerzeichen;l eːɐ ts aɪ ç ə n
Lefze;l ɛ f ts ə
Legasthenie;l e ɡ a s t ə n iː
Legastheniker;l e ɡ a s t e n iː k ɐ
Legende;l e ɡ ɛ n d ə
Legierungsbestandteil;l e ɡ iː r ʊ ŋ s b ə ʃ t a n t t aɪ l
Legierungselement;l e ɡ iː r ʊ ŋ s ʔ e l e m ɛ n t
Legierungsmetall;l e ɡ iː r ʊ ŋ s m ə t a l
Legion;l e ɡ j oː n
Leguan;l eː ɡ u aː n
Leguminose;l eː ɡ u m i n oː z ə
Lehen;l eː ə n
Lehm;l eː m
Lehnübersetzung;l eː n ʔ yː b ɐ z ɛ t s ʊ ŋ
Lehnwort;l eː n v œɐ t s
Lehrbuch;l eːɐ b uː x
Lehrerin;l eː r ə r ɪ n
Lehrkörper;l eː r k œɐ b p ɐ
Lehrling;l iː r l ɪ ŋ
Lehrwerk;l eː r v ɐ k
Leib;l aɪ p
Leibwächter;l aɪ p v ɛ ç t ɐ
Leichenhalle;l aɪ ç ə n h a l ə
Leichenschauhaus;l aɪ ç ə n ʃ aʊ h aʊ s
Leichentuch;l aɪ ç ə n t uː x
Leichnam;l aɪ ç n aː m
Leichter;l aɪ ç t ɐ
Leichtmetall;l aɪ ç t m ə t a l
Leichtsinn;l aɪ ç t z ɪ n
Leier;l aɪ ɐ
Leierschwanz;l aɪ ɐ ʃ v a n ts
Leiharbeiterin;l aɪ h ʔ a r b aɪ t ə r ɪ n
Leiharbeiter;l aɪ h ʔ a r b aɪ t ɐ
Leiharbeit;l aɪ h ʔ a r b aɪ t
Leim;l aɪ m
Leinwand;l aɪ n v a n t
Leipziger;l aɪ p ts ɪ ɡ ɐ
Leiste;l aɪ s t ə
Leisten;l aɪ s t ə n
Leistungssport;l aɪ s t ʊ ŋ s ʃ p oːɐ r t
Leiterin;l aɪ t ə r ɪ n
Leitfähigkeit;l aɪ t f ɛː ɪ ç k aɪ t
Leitkegel;l aɪ t k eː ɡ ə l
Leitungsband;l aɪ t ʊ ŋ s b a n t
Leitungsweg;l aɪ t ʊ ŋ s v eː k
Lektion;l ɛ k ts j oː n
Lektüre;l ɛ k t yː r ə
Lemmagruppe;l ɛ m a ɡ r ʊ p ə
Lemmaliste;l ɛ m a l ɪ s t ə
Lende;l ɛ n d ə
Lenker;l ɛ ŋ k ɐ
Lenkertasche;l ɛ ŋ k ɐ t a ʃ ə
Lenkstange;l ɛ ŋ k ʃ t a ŋ ə
Lenz;l ɛ n ts
Leopardenhai;l eː oː p a r d ə n h aɪ
Leopard;l eː oː p a r t
Lepidolith;l ə p i d o l ɪ t
Lerche;l ɛɐ ç ə
Lesbarkeit;l ɛ s b a r k aɪ t
Lesbarsein;l ɛ s b a r z aɪ n
Lesebeispiel;l eː z eː b aɪ ʃ p iː l
Lesekopf;l eː z ə k ɔ p f
Lesen;l eː z ə n
Lesezeichen;l eː z ə ts aɪ ç ə n
Lette;l ɛ t ə
Lettin;l ɛ t ɪ n
Leuchte;l ɔʏ ç t ə
Leuchter;l ɔʏ ç t ɐ
Leuchtgas;l ɔʏ ç t ɡ a s
Leuchtkäfer;l ɔʏ ç t k ɛː f ɐ
Leuchtstoff;l ɔʏ ç t ʃ t ɔ f
Leuchtturm;l ɔʏ t ə
Leucit;l ɔʏ ts ɪ t
Leugnung;l ɔʏ ɡ n ʊ ŋ
Leukoxen;l ɔʏ k ɔ k s ə n
Leukozyt;l ɔʏ k o ts yː t
Leumund;l ɔʏ m ʊ n t
Leutnant;l ɔʏ t n a n t
Levkoje;l ɛ v k oː j ə
Lewisit;l e v i z ɪ t
Lexem;l ɛ k s ə m
Libanese;l i b a n eː z ə
Libanesin;l i b a n eː z ɪ n
Libelle;l iː b ɛ l ə
Liberianer;l iː b ə r j aː n ɐ
Libyer;l i b j ɐ
Lichtbogenofen;l ɪ ç t b oː ɡ ə n ʔ oː f ə n
Lichtchen;l ɪ ç t ç ə n
Lichtfarbe;l ɪ ç t f a r b ə
Lichtgeschwindigkeit;l ɪ ç t ɡ ə ʃ v ɪ n d ɪ ç k aɪ t
Lichtjahr;l ɪ ç t j aː r
Lichtmessgerät;l ɪ ç t m ɛ s ɡ ə r ɛː t
Lichtquelle;l ɪ ç t k v ɛ l ə
Lichtschalter;l ɪ ç t ʃ a l t ɐ
Lid;l ɪ t
Lidschatten;l ɪ t ʃ a t ə n
Liebchen;l iː p ç ə n
Liebenswürdigkeit;l iː b ə n s v yː r d ɪ ç k aɪ t
Liebhaberei;l iː p h aː b ə r aɪ
Liebling;l iː p l ɪ ŋ
Liedchen;l iː t ç ə n
Lied;l iː t
Lieferant;l i f ə r a n t
Lieferung;l iː f ə r ʊ ŋ
Liege;l iː ɡ ə
Ligandenaustausch;l i ɡ a n d ə n ʔ aʊ s t aʊ ʃ
Lignin;l ɪ ç n ɪ n
Likör;l i k øːɐ
Lilie;l iː l j ə
Limone;l iː m oː n ə
Limonit;l iː m oː n iː t
Linde;l ɪ n d ə
Lindenbaum;l ɪ n d ə n b aʊ m
Lindwurm;l ɪ n t v ʊɐ s m
Linguistik;l ɪ ŋ ɡ u ɪ s t ɪ k
Linguistin;l ɪ ŋ ɡ u ɪ s t ɪ n
Linguist;l ɪ ŋ ɡ u ɪ s t
Linie;l iː n j ə
Linksruck;l ɪ ŋ k s r ʊ k
Linksverkehr;l ɪ ŋ k s f ɐ k eːɐ
Linnen;l ɪ n ə n
Linolschnitt;l i n ɔ l ʃ n ɪ t
Linse;l ɪ n z ə
Lipid;l ɪ p iː t
Lippe;l ɪ p ə
Lippenbekenntnis;l ɪ p ə n b ə k ɛ n t n ɪ s
Lippenstift;l ɪ p ə n ʃ t ɪ f t
Liquidator;l i k v i d aː t t ɐ
Liste;l ɪ s t ə
List;l ɪ s t
Litauer;l i t aʊ ɐ
Literatur;l ɪ t ə r a t uːɐ
Liter;l iː t ɐ
Lithiumisotop;l ɪ t j ʊ m i z o t oː p
Lithosphäre;l ɪ t o s f ɛː r ə
Liturgie;l i t ʊɐ k ə iː
Livree;l aɪ r eː
Lizenz;l i ts ɛ n ts
Lob;l oː p
Locher;l ɔ x ɐ
Loch;l ɔ x
Locked-in-Syndrom;l ɔ k ə t ʔ ɪ n z ʏ n d r oː m
Locke;l oː ʒ ə
Lockerung;l ɔ k ə r ʊ ŋ
Löffelchen;l œ f ə l ç ə n
Löffelente;l œ f ə l ɛ n t ə
Loge;l oː ʒ ə
Logikgatter;l oː ɡ ɪ k ɡ a t ɐ
Lohnnebenkosten;l oː n eː b ə n k ɔ s t ə n
Lokalelement;l o k a l eː l eː m ɛ n t
Lokal;l o k aː l
Lokalrunde;l o k aː l r ʊ n d ə
Lokführer;l oː k f yː r ɐ
Löllingit;l œ l ɪ ŋ iː t
Lonsdaleit;l oː n s d a l aɪ t
Loparit;l ə p a r ɪ t
Lorbeerblatt;l ɔɐ b ə ʔ aɪ ɐ r b l a t
Lorbeer;l ɔɐ b eːɐ
Löschpapier;l œ ʃ p a p iː ə
Löslichkeitsprodukt;l øː s l ɪ ç k aɪ t s p r o d ʊ k t
Los;l oː s
Lot;l oː t
Lötmetall;l œ t m ə t a l
Lotse;l ɔ t s ə
Lotterie;l ɔ t e r iː
Lötzinn;l œ t s ʔ ɪ n
Löwchen;l œ f ç ə n
Löwe;l øː v ə
Löwenanteil;l øː v ə n ʔ a n t aɪ l
Löwenkopf;l øː v ə n k ɔ p f
Löwenmähne;l øː v ə n m ɛː n ə
Löwenzahn;l øː v ə n ts aː n
Löwin;l øː v ɪ n
Lübecker;l yː b ɛ k ɐ
Luchs;l ʏ ç s
Lucianer;l uː ts j aː n ɐ
Lücke;l ʏ k ə
Lückentest;l ʏ k ə n t ə s t
Lückentext;l ʏ k ə n t ɛ k s t
Lückentexttest;l ʏ k ə n t ɛ k s t ɛ s t
Ludwigsburger;l uː t v ɪ ç s b t r ɡ ɐ
Luftabschluss;l ʊ f t ʔ a p ʃ l ʊ s
Luftangriff;l ʊ f t ʔ a n ɡ r ɪ f
Luftballon;l ʊ f t b a l ɔ ŋ
Luftbild;l ʊ f t b ɪ l t
Luftblase;l ʊ f t b l aː z ə
Lüfter;l ʏ f t ɐ
Luftkissenboot;l ʊ f t k ɪ s ə n b oː t
Luftpolsterfolie;l ʊ f t p ɔ l s t ɐ f n l j ə
Luftpumpe;l ʊ f t p ʊ m p ə
Luftschiff;l ʊ f t ʃ ɪ f
Luftschlag;l ʊ f t ʃ l aː k
Luftschlange;l ʊ f t ʃ l a ŋ ə
Luftstrom;l ʊ f t ʃ t r oː m
Lügner;l yː ɡ n ɐ
Luminometer;l uː m i n o m eː t ɐ
Luminophor;l uː m i n oː f ɔ r
Lümmeltüte;l ʏ m ə l t yː t ə
Lumpen;l ʊ m p ə n
Lund;l ʊ n t
Lunge;l ʊ ŋ ə
Lungenkrankheit;l ʊ ŋ ə n k r a ŋ k h aɪ t
Lungenkrebs;l ʊ ŋ ə n k r ə p s
Lungenödem;l ʊ ŋ ə n øː d ə m
Lungenproblem;l ʊ ŋ ə n p r o b l eː m
Lunisolarkalender;l u n i z o l aː r k a l ɛ n d ɐ
Lupe;l uː p ə
Lupine;l u p ɪ n ə
Lurch;l ʊɐ ç ʃ
Lusitanerin;l uː z i t aː n ə r ɪ n
Lusitaner;l uː z i t aː n ɐ
Luster;l ʊ s t ɐ
Lüster;l ʏ s t ɐ
Lustknabe;l ʊ s t k n aː b ə
Lustspiel;l ʊ s t ʃ p iː l
Lutetium;l uː t e ts j ʊ m
Lutscher;l ʊ t ʃ ɐ
Lutschtablette;l ʊ t ʃ t aː b l ɛ t ə
Lymphdrüse;l ʏ m p d r yː z ə
Lymphe;l ʏ m p ə
Lymphsystem;l ʏ m p s ʏ s t eː m
Maat;m aː t
Macchie;m a k s j ə
Macher;m a x ɐ
Machthaberin;m a x t aː b ə r ɪ n
Machthaber;m a x t aː b ɐ
Machtkämpfchen;m a x t k ɛ m p f ç ə n
Macke;m a k ə
Macker;m a k ɐ
Mädchenname;m ɛː t ç ə n aː m ə
Made;m aː d ə
Madenhacker;m aː d ə n h a k ɐ
Madenkäse;m aː d ə n k ɛː z ə
Madenschraube;m aː d ə n ʃ r aʊ b ə
Madenwurm;m aː d ə n v ʊɐ s m
Madrigal;m a d r i ɡ aː l
Mägdlein;m ʔ ɛː k t l aɪ n
Magd;m a k t
Magenentzündung;m aː ɡ ə n ʔ ɛ n t t s ʏ n d ʊ ŋ
Mageninhalt;m a ɡ ə n ʔ ɪ n h a l t
Magenkrebs;m aː ɡ ə n k r ə p s
Magen;m aː ɡ ə n
Magensaft;m aː k ʔ ɛ n z a f t
Magenschmerz;m aː ɡ ə n ʃ m ɐ ts
Magier;m aː ɡ j ɐ
Magister;m a ɡ ɪ s t ɐ
Magistrale;m a ɡ ɪ s t r aː l ə
Magistrat;m a ɡ ɪ s t r aː t
Magnesit;m aː ɡ n eː z ɪ t
Magnesiumion;m aː ɡ n eː z j ʊ m j ɔ n
Magnesiumsalz;m aː ɡ n eː z j ʊ m z a l ts
Magnetbandgerät;m a ɡ n ə t b a n t ɡ ə r ɛː t
Magneteisenerz;m a ɡ n eː t ʔ aɪ z ə n ɐ ts
Magneteisenstein;m a ɡ n eː t ʔ aɪ z ə n ʃ t aɪ n
Magnetfeld;m a ɡ n ɛ t f ɛ l t
Magnetit;m a ɡ n ə t ɪ t
Magnetkies;m a ɡ n ɛ t k iː s
Magnet;m a ɡ n ə t
Magnetron;m a ɡ n ə t r oː n
Magnetstein;m a ɡ n ɛ t ʃ t aɪ n
Magnolie;m a ɡ n o l iː
Mähdrescher;m ʔ ɛː d r ɛ ʃ ɐ
Mahl;m aː l
Mahlstrom;m a l ʃ t r oː m
Mahlzeit;m aː l ts aɪ t
Mähnenhund;m ɛː n ə n h ʊ n t
Mähnenratte;m ɛː n ə n r a t ə
Mähnenrobbe;m ɛː n ə n r ɔ b ə
Mähnenwolf;m ɛː n ə n v ɔ l f
Mahnwache;m a n v a x ə
Maibaum;m aɪ b aʊ m
Maiglöckchen;m aɪ ɡ l œ k ç ə n
Mailänder;m aɪ l ɛ n d ɐ
Mail;m eː l
Mainzer;m aɪ n ts ɐ
Mairenke;m aɪ ɐ ŋ k ə
Maiskolben;m aɪ s k ɔ l b ə n
Majoran;m a j o r aː n
Majuskel;m a j ʊ s k ə l
Make-up;m aː k ə ʔ ʊ p
Makler;m aː k l ɐ
Makrele;m a k r eː l ə
Makronährstoff;m a k r o n ɛː ɐ ʃ t ɔ f
Makulatur;m a k u l aː t uːɐ ɐ
Malaysierin;m a l aɪ z iː r ɪ n
Malaysier;m a l aɪ z iː ə
Malediverin;m aː l e d iː v e r iː n
Malediver;m aː l e d iː v ɐ
Maltese;m a l t eː z ə
Malteser;m a l t eː z ɐ
Malve;m aː l v ə
Malz;m a l ts
Mammakarzinom;m a m aː k a r ts i n oː m
Mammut;m a m uː t
Management;m ɛ n ɪ tʃ m ɛ n t
Managementsystem;m ɛ n ɪ dʒ ə m ɛ n t z ʏ s t eː m
Manager;m ɛ n ɪ dʒ ɐ
Mandarine;m a n d a r iː n ə
Mandarinente;m a n d a r iː n ɛ n t ə
Mandarinfisch;m a n d a r ɪ n f ɪ ʃ
Mandat;m a n d aː t
Mandelbaum;m a n d ə l b aʊ m
Mandoline;m a n d o l iː n ə
Manen;m a n ə n
Manganat;m a ŋ ɡ aː n a t
Manganhalogenid;m a ŋ ɡ a n h a l oː ɡ ə n ɪ d
Mangelsymptom;m a ŋ ə l z ʏ m p t oː m
Mangold;m a ŋ ɡ ɔ l t
Mangostane;m a ŋ ɡ ɔ s t aː n ə
Mangrove;m a ŋ ɡ r oː v ə
Mangrovenwald;m a ŋ ɡ r oː v ə n v a l t
Mangroveralle;m a ŋ ɡ r o v ə r a l ə
Manier;m a n j ɐ
Manipulierbarkeit;m a n i p u l iː r b aː r k aɪ t
Manipuliererin;m a n i p u l iː r ə r ɪ n
Manipulierer;m a n i p u l iː r ɐ
Manipulierung;m a n i p u l iː r ʊ ŋ
Männchen;m ɛ n ç ə n
Mannheimer;m a n h aɪ m ɐ
Männlein;m ɛ n l aɪ n
Männlichkeit;m ɛ n l ɪ ç k aɪ t
Mannsschild;m a n s ʃ ɪ l t
Manöver;m a n øː v ɐ
Mansarde;m a n z a r d ə
Manschette;m a n ʃ ɛ t ə
Mansfelder;m a n s f ɛ l d ɐ
Mantel;m a n t ə l
Manteltier;m a n t ə l t iː ə
Manual;m a n u aː l
Manufaktur;m a n ʔ uː f a k t uːɐ ɐ
Mäppchen;m ɛ p b ç ə n
Marathon;m a r a t ɔ ŋ
Märchenbuch;m œɐ d ç ə n b uː x
Märchen;m ɛːɐ ç ə n
Marder;m a r d ɐ
Margellchen;m a r ɡ ɛ l l ç ə n
Margerite;m a r ɡ ə r iː t ə
Marille;m a r ɪ l ə
Marinade;m a r i n aː d ə
Marionette;m a r j o n ɛ t ə
Marjellchen;m a r j ɛ l l ç ə n
Marke;m a r k ə
Markenname;m a r k ə n aː m ə
Markgraf;m aː r k ɡ r aː f
Markierung;m a r k iː r ʊ ŋ
Markierungsschnittstelle;m a r k iː r ʊ ŋ s ʃ n ɪ t ʃ t ɛ l ə
Markise;m a r k iː z ə
Marktanteil;m a r k t ʔ a n t aɪ l
Marktführer;m a r k t f yː r ɐ
Marktplatz;m a r k t p l a t s
Marktwert;m a r k t v ɐ t
Mär;m ɛɐ
Marmelade;m a r m ə l aː d ə
Marmorkatze;m a r m ɔɐ k ə ʔ a t s ə
Marmor;m a r m ɔ r
Marodeur;m a r oː d øː r
Marokkaner;m a r ɔ k aː n ɐ
Marone;m a r oː n ə
Marotte;m a r ɔ t ə
Marschall;m a r ʃ a l
Marshalling;m a r ʃ a l ɪ ŋ
Märtyrerin;m œɐ t s y r ə r ɪ n
Märtyrer;m œɐ t s y r ɐ
Martyrologium;m ɛ r t i r o l oː ɡ j ʊ m
Marxist;m a r k s ɪ s t
Maschendrahtzaun;m a ʃ ə n t r aː t s ʔ aʊ n
Maschinengewehr;m a ʃ iː n ə n ɡ ə v eː r
Maschinenraum;m a ʃ iː n ə n r aʊ m
Maschinensprache;m a ʃ iː n ə n ʃ p r aː x ə
Maser;m aː z ɐ
Maske;m a s k ə
Maskulinum;m a s k u l i n ʊ m
Massage;m a s aː ʒ ə
Maßband;m aː s b a n t
Massenanteil;m a s ə n ʔ a n t aɪ l
Massenarbeitslosigkeit;m a s ə n ʔ a r b aɪ t s l oː z ɪ ç k aɪ t
Massenbewegung;m a s ə n b ə v eː ɡ ʊ ŋ
Massendefekt;m a s ə n d e f ɛ k t
Massenprozent;m a s ə n p r o ts ɛ n t
Massenspektrometer;m a s ə n ʃ p ɛ k t r o m eː t ɐ
Massenunterschied;m a s ə n ʔ ʊ n t ɐ ʃ iː t
Masseprozent;m a s e p r oː ts ɛ n t
Masseurin;m a s øː r iː n
Masseur;m a s øːɐ
Maßkolben;m a s k ɔ l b ə n
Maßnahme;m aː s n aː m ə
Maßstab;m a s ʃ t a p
Master;m aː s t ɐ
Masturbation;m a s t u r b a ts j oː n
Match;m ɛ tʃ
Mathematikerin;m a t e m a t iː k ə r ɪ n
Mathematiker;m a t e m a t ɪ k ɐ
Matjeshering;m a t j ə s h eː r ɪ ŋ
Matjes;m a t j ə s
Matrose;m a t r oː z ə
Matte;m a t ə
Matt;m a t
Mauerspecht;m aʊ ɐ ʃ p ɛ ç t
Mauke;m aʊ k ə
Maulbeere;m aʊ l b e r ə
Maul;m aʊ l
Maulschelle;m aʊ l ʃ ɛ l ə
Maulwurfsgrille;m ʔ aʊ l v uːɐ f f s ɡ r ɪ l ə
Maure;m aʊ r ə
Maurer;m aʊ r ɐ
Mäuschen;m ɔʏ s ç ə n
Mäusebussard;m ɔʏ z eː b ʊ s a r t
Mauseloch;m aʊ z ə l ɔ x
Mäusespeck;m ɔʏ z ə ʃ p ɛ k
Maut;m aʊ t
Maxime;m a k s ɪ m ə
Maximierung;m a k s i m iː r ʊ ŋ
Maximum;m a k s i m ʊ m
Mazedonier;m a ts e d oː n iː ə
Mechanikerin;m e ç aː n ɪ k ə r ɪ n
Medaille;m e d a l j ə
Mediatorin;m e d j a t oː r iː n
Mediator;m e d j a t ɔ r
Mediengeschichte;m eː d iː n ɡ ə ʃ ɪ ç t ə
Medienhistorikerin;m eː d j ə n h ɪ s t oː r i k ə r ɪ n
Medienhistoriker;m eː d j ə n h ɪ s t oː r ɪ k ɐ
Medienwissenschaftlerin;m eː d j ə n v ɪ s ə n ʃ a f t l ə r ɪ n
Medienwissenschaftler;m eː d j ə n v ɪ s ə n ʃ a f t l ɐ
Medikament;m e d i k a m ɛ n t
Medizinerin;m e d i ts iː n ə r ɪ n
Medizin;m e d i ts iː n
Medizinprodukt;m e d aɪ ts iː n p r o d ʊ k t
Medresse;m e d r ɛ s ə
Meeresboden;m eː r ə s b oː d ə n
Meeresfisch;m eː r ə s f ɪ ʃ
Meeresküste;m eː r ə s k ʏ s t ə
Meeresschwamm;m eː r ə s ʃ v a m
Meeressediment;m eː r ə s s ə d i m ɛ n t
Meeresströmung;m eː r ə s ʃ t r øː m ʊ ŋ
Meerestier;m eː r ə s t iː ə
Meerschweinchen;m eːɐ ʃ v aɪ n ç ə n
Meeting;m iː t ɪ ŋ
Mehl;m eː l
Mehlschwalbe;m eː l ʃ v a l b ə
Mehrdeutigkeit;m eː r d ɔʏ t ɪ ç k aɪ t
Mehrdimensionalität;m eː r d iː m ɛ n z j o n a l i t ɛː t
Mehrfachauswahlfrage;m eː r f a x ʔ aʊ s v aː l f r aː ɡ ə
Mehrfachvererbung;m eː r f a x v ə r ɐ b ʊ ŋ
Mehrheit;m eːɐ h aɪ t
Mehrsprachigkeit;m eː ɐ ʃ p r aː x ɪ ç k aɪ t
Mehrwertsteuer;m eːɐ v eːɐ t ʃ t ɔʏ ɐ
Mehrzahl;m eːɐ ts aː l
Meier;m aɪ ɐ
Meile;m aɪ l ə
Meiler;m aɪ l ɐ
Meinung;m aɪ n ʊ ŋ
Meissel;m aɪ s ə l
Meißel;m aɪ s ə l
Meitnerium;m aɪ t n ə r j ʊ m
Melanterit;m ɛ l a n t ə r ɪ t
Melde;m ɛ l d ə
Meldezettel;m ɛ l d ə ts ɛ t ə l
Meldung;m ɛ l d ʊ ŋ
Melisse;m e l ɪ s ə
Melker;m ɛ l k ɐ
Melodie;m e l o d iː
Melodrama;m e l o d r aː m a
Melone;m e l oː n ə
Membrane;m ɛ m b r aː n ə
Membran;m ɛ m b r a n
Membranpotential;m ɛ m b r a n p o t ɛ n ts j aː l
Menage;m e n aː ɡ ə
Mendelevium;m ɛ n d e l ɛ v j ʊ m
Menge;m ɛ ŋ ə
Mengenrabatt;m ɛ ŋ ə n r a b a t
Mennigvogel;m ɛ n ɪ ç v oː ɡ ə l
Menschenfreund;m ɛ n ʃ ə n f r ɔʏ n t
Menschenhandel;m ɛ n ʃ ə n h a n d ə l
Menschenhand;m ɛ n ʃ ə n h a n t
Menschheitsbeglücker;m ɛ n ʃ h aɪ t s b ə ɡ l ʏ k ɐ
Mensch;m ɛ n ʃ
Mercaptan;m œɐ d k ɛ p t aː n
Meridian;m ɛ r iː d j a n
Merkel-Raute;m ɛɐ k ə l r aʊ t ə
Merseburgerin;m œɐ z o eː b t r ɡ ə r ɪ n
Mesologie;m eː z o l o ɡ iː
Messbarkeit;m ɛ s b aː r k aɪ t
Messbecher;m ɛ s b ɛ ç ɐ
Messdiener;m ɛ s d iː n ɐ
Messe;m ɛ s ə
Messgerät;m ɛ s ɡ ə r ɛː t
Messias;m ɛ s j aː s
Messie;m ɛ s iː
Messkolben;m ɛ s k ɔ l b ə n
Messwert;m ɛ s v ɐ t
Messy;m ɛ s z i
Metaborat;m e t aː b oː r aː t
Metallanteil;m e t a l ʔ a n t aɪ l
Metallatom;m e t a l a t oː m
Metallgeschmack;m e t a l ɡ ə ʃ m a k
Metallgitter;m e t a l ɡ ɪ t ɐ
Metall;m e t a l
Metallocen;m e t aː l ɔ ts ə n
Metalloid;m e t a l ɔʏ t
Metalloprotein;m e t a l o p r o t e iː n
Metallothionein;m e t a l oː t j ɔ n ʔ aɪ n
Metalloxid;m e t a l ɔ k s iː t
