Epoche;ʔ e p ɔ x ə
Epos;ʔ e p ɔ s
Epoxid;ʔ e p ɔ k s iː t
Epsilon;ʔ ɛ p s i l ɔ n
Epsomit;ʔ ɛ p z o m iː t
Equilibrium;ʔ ɛ k v i l i b r i ʊ m
Erbfeind;ʔ ɛɐ p s f aɪ n t
Erbfolge;ʔ ɛɐ r p f ɔ l ɡ ə
Erbgut;ʔ ɛɐ b p ɡ ʊ t
Erbin;ʔ ɛɐ r b iː n
Erbium;ʔ ɛɐ b aʊ dʒ a m
Erbobergespan;ʔ ɛɐ r b oː b ɐ ɡ ə s p a n
Erbobergespann;ʔ ɛɐ r b oː b ɐ ɡ ə ʃ p a n
Erbonkel;ʔ ɛɐ r b ɔ ŋ k ə l
Erbrechen;ʔ ɛɐ p b r ɛ ç ə n
Erbrütung;ʔ ɛɐ r b r yː t ʊ ŋ
Erbse;ʔ ɛɐ p s ə l
Erbtante;ʔ ɛɐ t b t a n t ə
Erdalkalimetall;ʔ ɛɐ m d aː l k a l i m ə t a l
Erdalkalimetallion;ʔ ɛɐ m d aː l k a l i m ə t a l j oː n
Erdapfel;ʔ ɛɐ r t a p f ə l
Erdatmosphäre;ʔ ɛɐ r d a t m o s f ɛː r ə
Erdbeben;ʔ eːɐ t b eː b ə n
Erdbeerbaum;ʔ ɛɐ p t b eː r b aʊ m
Erdbeere;ʔ eːɐ t b eː r ə
Erdbewohner;ʔ ɛɐ p t b ə v oː n ɐ
Erdbirne;ʔ ɛɐ r t b ɪ ɐ n ə
Erdboden;ʔ eːɐ t b oː d ə n
Erderwärmung;ʔ ɛɐ r d ɐ v ɐ m ʊ ŋ
Erdgas;ʔ eːɐ t ɡ aː s
Erdgasfeld;ʔ ɛɐ t ɡ a s f ɛ l t
Erdgeschoss;ʔ eːɐ t ɡ ə ʃ ɔ s
Erdgeschoß;ʔ eːɐ t ɡ ə ʃ ɔ s
Erdhülle;ʔ ɛɐ r t h ʏ l ə
Erdkern;ʔ ɛɐ p t k ɐ n
Erdkruste;ʔ ɛɐ r t k r ʊ s t ə
Erdling;ʔ ɛɐ r d l ɪ ŋ
Erdmännchen;ʔ ɛɐ r t m ɛ n ç ə n
Erdmantel;ʔ ɛɐ t m ɛ a n t ə l
Erdnatter;ʔ ɛɐ t s n a t ɐ
Erdnuss;ʔ ɛɐ b t n ʊ s
Erdoberfläche;ʔ ɛɐ r d oː b ɐ f l ɛ ç ə
Erdölprodukt;ʔ ɛɐ m d œ l p r o d ʊ k t
Erdrinde;ʔ ɛɐ r t r ɪ n d ə
Erdrutsch;ʔ ɛɐ b d r ʊ t ʃ
Erdstoß;ʔ ɛɐ r t ʃ t oː s
Ereignis;ʔ ɛɐ ʔ aɪ ɡ n ɪ s
Ereignishorizont;ʔ eː r aɪ n ɪ s h o r i ts ɔ n t
Erektion;ʔ e r ɛ k ts j oː n
Eremit;ʔ e r eː m iː t
Eremitin;ʔ e r e m i t ɪ n
Erfahrung;ʔ ɛɐ f aː r ʊ ŋ
Erfinderin;ʔ ɛ r f ɪ n d ə r ɪ n
Erforschung;ʔ ɛɐ f ɔɐ ʃ ʊ ŋ
Erfrischung;ʔ ɛɐ f r ɪ ʃ ʊ ŋ
Erguss;ʔ ɛɐ ɛɐ ɡ ʊ s
Erhalt;ʔ ɛɐ h a l t
Erhitzung;ʔ ɛɐ r h ɪ t s ʊ ŋ
Erhöhung;ʔ ɛɐ h øː ʊ ŋ
Erinnerung;ʔ ɛɐ ʔ ɪ n ɐ r ʊ ŋ
Erkenntlichkeit;ʔ ɛɐ r k ə n t l ɪ ç k aɪ t
Erker;ʔ ɛɐ r k ɐ
Erklärung;ʔ ɛɐ k l ɛː r ʊ ŋ
Erkrankung;ʔ ɛɐ k r a ŋ k ʊ ŋ
Erlebnis;ʔ ɛɐ l eː p n ɪ s
Erle;ʔ ɛɐ l e
Erlenmeyerkolben;ʔ ɛɐ r l eː n m aɪ ɐ k ɔ l b ə n
Erlkönig;ʔ ɛɐ r l k øː n ɪ ç
Erlöser;ʔ ɛɐ r l øː z ɐ
Erlös;ʔ ɛɐ l øː s
Erlösung;ʔ ɛɐ l øː z ʊ ŋ
Ermittler;ʔ ɛɐ m ɪ t l ɐ
Ermittlungsverfahren;ʔ ɛɐ r m ɪ t l ʊ ŋ s f ɐ f aː r ə n
Ermöglichen;ʔ ɛɐ m øː k l ɪ ç ə n
Ermöglichung;ʔ ɛɐ r m øː k l ɪ ç ʊ ŋ
Ernährer;ʔ ɛɐ m n ɛː r ɐ
Ernte;ʔ ɛɐ p n t ə
Eroberung;ʔ ɛɐ ʔ oː b ə r ʊ ŋ
Eroberungszug;ʔ e r oː b ə r ʊ ŋ s ts uː k
Eröffnung;ʔ ɛɐ ʔ œ f n ʊ ŋ
Erörterung;ʔ ɛɐ ʔ œɐ t ə r ʊ ŋ
Erpel;ɛɐ b p ə l
Erpresser;ɛɐ b p r ɛ s ɐ
Erprobung;ɛɐ b p r oː b ʊ ŋ
Erreger;ʔ ɛɐ r eː ɡ ɐ
Erregung;ʔ ɛɐ r eː ɡ ʊ ŋ
Erreichen;ʔ ɛɐ r aɪ ç ə n
Ersatzfrau;ʔ ɛ r z a t s f r aʊ
Ersatzmann;ʔ ɛ r z a t s m a n
Ersatzreifen;ʔ ɛ r z a t s r aɪ f ə n
Ersatzstoff;ʔ ɛ r z a t s ʃ t ɔ f
Erscheinung;ʔ ɛɐ ʃ aɪ n ʊ ŋ
Erschießung;ʔ ɛ r ʃ iː s ʊ ŋ
Erschütterung;ʔ ɛ r ʃ ʏ t ə r ʊ ŋ
Erstarren;ʔ ɛ r ʃ t a r ə n
Erstkommunion;ʔ ɛ r s t k ɔ m uː n j oː n
Ersttäter;ʔ ɛ r s t t ɛː t ɐ
Ersuchen;ʔ ɛ r z uː x ə n
Erwachsenenalter;ʔ ɛɐ r v a k s e n ə n aː l t ɐ
Erwartung;ʔ ɛɐ v a r t ʊ ŋ
Erythrozyt;ʔ eː r aɪ t h ɔɐ o ts yː t
Erzabtei;ʔ ɛɐ r ts ʔ a p t aɪ
Erzähler;ʔ ɛɐ ts ɛː l ɐ
Erzählerin;ʔ ɛɐ m ts ɛː l ə r ɪ n
Erzählung;ʔ ɛɐ ts ɛː l ʊ ŋ
Erzbischof;ʔ ɛɐ ts b ɪ ʃ ɔ f
Erzdiözese;ʔ ɛɐ r ts d j øː z eː z ə
Erzdruide;ʔ ɛɐ r ts d r u i d ə
Erzengel;ʔ ɛɐ r ts ə n ɡ ə l
Erz;ʔ ɛɐ ts
Erzeuger;ʔ ɛɐ ts ɔʏ ɡ ɐ
Erzeugnis;ʔ ɛɐ ts ɔʏ k n ɪ s
Erzeugung;ʔ ɛɐ ts ɔʏ ɡ ʊ ŋ
Erzfeind;ʔ ɛɐ p ts f aɪ n t
Erzgang;ʔ ɛɐ t s ɡ a ŋ
Erzherzogshütchen;ʔ ɛɐ p ts h ɐ t s oː k s h ʏ t ç ə n
Erzherzogshut;ʔ ɛɐ p ts h ɐ t s oː k s h uː t
Erzherzogtum;ʔ ɛɐ p ts h ɐ t s oː k t uː m
Erzieher;ʔ ɛɐ p ts iː h ɐ
Erziehung;ʔ ɛɐ ts iː ʊ ŋ
Erzielung;ʔ ɛɐ p ts iː l ʊ ŋ
Erzkanzler;ʔ ɛɐ t s k a n t s l ɐ
Erzlager;ʔ ɛɐ t s l aː ɡ ɐ
Erzpriester;ʔ ɛɐ r ts p r iː s t ɐ
Erzvorkommen;ʔ ɛɐ r ts f oːɐ r k ɔ m ə n
Eschatologie;ʔ ɛ ʃ a t o l o ɡ iː
Esche;ʔ ɛ ʃ ə
Esel;ʔ eː z ə l
Eselhaftigkeit;ʔ eː z ə l h a f t ɪ ç k aɪ t
Eselsbrücke;ʔ eː z ə l s b r ʏ k ə
Eselsohr;ʔ eː z ɛ l s ɔ r
Eselspinguin;ʔ eː z ɛ l ʃ p ɪ ŋ ɡ u ɪ n
Eskapade;ʔ ɛ s k a p a d ə
Eskorte;ʔ ɛ s k oːɐ r t ə
Espe;ʔ ɛ s p ə
Esperantist;ʔ ɛ s p ə r a n t ɪ s t
Esplanade;ʔ ɛ s p l a n aː d ə
Espresso;ʔ ɛ s p r ɛ s o
Esprit;ʔ ɛ s p r ɪ t
Essener;ʔ ɛ s ə n ɐ
Essig;ʔ ɛ s ɪ ç
Essigfliege;ʔ ɛ s ɪ ɡ f l iː ɡ ə
Essigsäurechlorid;ʔ ɛ s ɪ ç z ɔʏ r ɛ ç l o r iː t
Esslöffel;ʔ ɛ s l œ f ə l
Essstäbchen;ʔ ɛ s ʃ t ɛː p ç ə n
Eßstäbchen;ʔ ɛ s ʃ t ɛː p ç ə n
Essstörung;ʔ ɛ s ʃ t øː r ʊ ŋ
Esszimmer;ʔ ɛ s ts ɪ m ɐ
Este;ʔ ɛ s t ə
Ester;ʔ ɛ s t ɐ
Estrade;ʔ ɛ s t r aː d ə
Estrich;ʔ ɛ s t r ɪ ç
Etablissement;ʔ e t ʔ a p l ɪ s z e m ɛ n t
Eta;ʔ eː t a
Etage;ʔ e t aː ʒ ə
Etappe;ʔ e t a p ə
Etat;ʔ e t aː
Ethanthiol;ʔ ɛ t a n t j ɔ l
Ether;ʔ ɛ t ɐ
Ethik;ʔ eː t ɪ k
Ethnologe;ʔ ɛ t n o l oː ɡ ə
Ethnologin;ʔ ɛ t n o l oː ɡ ɪ n
Ethoxylat;ʔ ɛ t ɔ k s yː l a t
Ethylalkohol;ʔ ɛ t ɪ l a l k o h oː l
Ethylen;ʔ ɛ t yː l ə n
Ethylenoxid;ʔ ɛ t ʏ l e n ɔ k s iː t
Ethyl;ʔ ɛ t yː l
Etikett;ʔ e t ɪ k ɛ t
Etui;ʔ iː t u ɪ
Etymologe;ʔ e t y m o l oː ɡ ə
Etymologie;ʔ e t y m o l o ɡ iː
Eucharistie;ʔ ɔʏ ç aː r ɪ s t iː
Eudialyt;ʔ ɔʏ d j ə l yː t
Eukalyptus;ʔ ɔʏ k a l ʏ p t uː s
Eunuch;ʔ ɔʏ n uː x
Euphemismus;ʔ ɔʏ f e m ɪ s m ʊ s
Euphorie;ʔ ɔʏ f o r iː
Europäer;ʔ ɔʏ r o p ɛːɐ
Europameister;ʔ ɔʏ r oː p a m aɪ s t ɐ
Europium;ʔ ɔʏ r oː p j ʊ m
Eutektikum;ʔ ɔʏ t ʔ e k t i k ʊ m
Euter;ʔ ɔʏ t ɐ
Euthanasie;ʔ ɔʏ t a n a z j ə
Euxenit;ʔ ɔʏ k s ə n ɪ t
Evangelisation;ʔ e v a ŋ ɡ e l i z a ts j oː n
Evangelist;ʔ e v a ŋ ɡ eː l ɪ s t
Evangelium;ʔ e v a ŋ ɡ eː l j ʊ m
Evaporit;ʔ e v a p o r i t
Evolutionist;ʔ e v o l u ts j o n ɪ s t
Evolutionistin;ʔ e v o l u ts j o n ɪ s t ɪ n
Excimerlaser;ʔ ɛ k s ts i m ɐ l a z ɐ
Exegese;ʔ ɛ k s e ɡ ə z ə
Exempel;ʔ ɛ k s ɛ m p ə l
Exemplar;ʔ ɛ k s ɛ m p l aː r
Exhibitionist;ʔ ɛ k s h i b i ts j o n ɪ s t
Exilant;ʔ ɛ k s i l a n t
Existentialist;ʔ ɛ k s ɪ s t ɛ n ts j a l ɪ s t
Exklave;ʔ ɛ k s k l aː v ə
Exkursion;ʔ ɛ k s k ʊɐ z j oː n
Exodus;ʔ ɛ k s o d ʊ s
Exoplanet;ʔ ɛ k s o p l aː n eː t
Exot;ʔ ɛ k s oː t
Expansion;ʔ ɛ k s p a n z j oː n
Expedition;ʔ ɛ k s p ə d i ts j oː n
Experiment;ʔ ɛ k s p e r i m ɛ n t
Experte;ʔ ɛ k s p ɛɐ t ə
Expertin;ʔ ɛ k s p ɐ t iː n
Explosivstoff;ʔ ɛ k s p l oː z iː f ʃ t ɔ f
Exponat;ʔ ɛ k s p o n aː t
Exporteur;ʔ ɛ k s p ɔɐ t ə ʔ ɔʏ r
Exposee;ʔ ɛ k s p o z eː
Exposé;ʔ ɛ k s p o z eː
Exposition;ʔ ɛ k s p o z i ts j oː n
Extraktionsverfahren;ʔ ɛ k s t r a k ts j oː n s f ɐ f aː r ə n
Extranet;ʔ ɛ k s t r aː n ə t
Extrem;ʔ ɛ k s t r eː m
Extremist;ʔ ɛ k s t r e m ɪ s t
Extremum;ʔ ɛ k s t r ə m ʊ m
Extrudieren;ʔ ɛ k s t r uː d iː r ə n
Exzellenz;ʔ ɛ k s ts ɛ l ɛ n ts
Exzentriker;ʔ ɛ k s ts ə n t r iː k ɐ
Exzess;ʔ ɛ k s ts ə s
E-Zigarette;ʔ eː ts i ɡ a r ɛ t ə
Fabel;f aː b ə l
Fabrikant;f a b r i k a n t
Fabrikarbeit;f a b r i k ʔ a r b aɪ t
Fabrikat;f a b r iː k aː t
Fabrikation;f a b r i k a ts j oː n
Facharzt;f a x ʔ a r ts t
Fach;f a x
Fachhochschule;f a x h oː x ʃ uː l ə
Fachinformatiker;f a x ʔ ɪ n f ɔɐ m a ts t ɪ k ɐ
Fachjargon;f a x j a r ɡ ɔ n
Fachkrankenschwester;f a x k r a ŋ k ə n ʃ v ɛ s t ɐ
Fachmarkt;f a x m a r k t
Fachsprache;f a x ʃ p r aː x ə
Fackel;f a k ə l
Fädchen;f ɛː t ç ə n
Faden;f aː d ə n
Fadenkreuz;f aː d ə n k r ɔʏ ts
Fadenlauf;f aː d ɛ n l aʊ f
Fagott;f aː ɡ ɔ t
Fagottist;f aː ɡ ɔ t ɪ s t
Fahlflanken-Ameisenwürger;f aː l f l a ŋ k ə n ʔ aː m aɪ z ə n v yː r ɡ ɐ
Fähnchen;f ɛː n ç ə n
Fahnder;f aː n d ɐ
Fahndungsliste;f aː n d ʊ ŋ s l ɪ s t ə
Fahne;f aː n ə
Fahnenflüchtige;f aː n ə n f l ʏ ç t ɪ ɡ ə
Fahnenstange;f aː n ə n ʃ t a ŋ ə
Fahnenträger;f aː n ə n t r ɛː ɡ ɐ
Fahrbahn;f aː r b aː n
Fähre;f ɛː r ə
Fahrer;f aː r ɐ
Fahrgestell;f aː r ɡ ə ʃ t ɛ l
Fahrplan;f aː r p l aː n
Fahrradfahrer;f aː r r aː t f aː r ɐ
Fahrradfahrerin;f aː r r aː t f aː r ə r ɪ n
Fahrradständer;f aː r r aː t ʃ t ɛ n d ɐ
Fahrradtasche;f aː r r a t t a ʃ ə
Fahrscheinautomat;f aː r ʃ aɪ n ʔ aʊ t o m aː t
Fahrschule;f aː r ʃ uː l ə
Fahrstuhl;f aː r ʃ t uː l
Fahrtwind;f aː r t v ɪ n t
Fahrwerk;f aː r v ɛɐ k
Fahrwind;f aː r v ɪ n t
Fahrzeugkatalysator;f aː r ts ɔʏ k k a t a l y z a t ɔ r
Fahrzeugtechnik;f aː r ts ɔʏ k t ɛ ç n ɪ k
Faible;f aɪ b l ə
Fakir;f a k i r
Faktor;f a k t ɔ r
Faktum;f a k t ʊ m
Fakultät;f a k ʊ l t ɛː t
Falbe;f a l b ə
Falbkatze;f a l p k a t s ə
Falke;f a l k ə
Fallbeil;f a l b aɪ l
Fallgatter;f a l ɡ a t ɐ
Fallreep;f a l r iː p
Fallrohr;f a l r oː r
Fallschirmjäger;f a l ʃ i r m i ɛː ɡ ɐ
Fallschirmspringer;f a l ʃ iː r m ʃ p r ɪ ŋ ɐ
Fallschirmspringerin;f a l ʃ iː r m ʃ p r ɪ ŋ ə r ɪ n
Fallstrick;f a l ʃ t r ɪ k
Fallturm;f a l t ʊɐ s m
Falsett;f a l z ɛ t
Falte;f a l t ə
Falter;f a l t ɐ
Falz;f a l ts
Familie;f a m iː l j ə
Familienmitglied;f a m iː l j ə n m ɪ t ɡ l iː d
Fanal;f a n aː l
Fanatiker;f a n aː t ɪ k ɐ
Fan;f a n
Fänger;f ɛ ŋ ɐ
Fang;f a ŋ
Fanmeile;f a n m aɪ l ə
Fantasie;f a n t a z iː
Fantast;f a n t a s t
Farbenblindheit;f a r b ə n b l ɪ n t h aɪ t
Färben;f ɛɐ b ə n
Farbenlehre;f a r b ə n l eː r ə
Farbenpracht;f a r b ə n p r a x t
Farbenspiel;f a r b ə n ʃ p iː l
Farbfernsehen;f a r p f ɐ n z eː ə n
Farbfernseher;f a r p f ɛɐ n z eːɐ
Farblack;f a r p l a k
Farbpigment;f a r p b ɪ n m ɛ n t
Farbstift;f a r p ʃ t ɪ f t
Farbstoff;f a r p ʃ t ɔ f
Farbton;f a r p t oː n
Färbung;f ɛɐ b ʊ ŋ
Farmer;f a r m ɐ
Farmersalat;f a r m ɐ z a l aː t
Färse;f ɛɐ z o eː
Fasan;f aː z a n
Faschist;f a ʃ ɪ s t
Fase;f aː z ə
Faser;f aː z ɐ
Fassade;f a s aː d ə
Fassbombe;f a s b oː m b ə
Fässchen;f ɛ s ʃ ə n
Fäßchen;f ɛ s ç ə n
Fass;f a s
Fasson;f a s o n
Fassung;f a s ʊ ŋ
Fasten;f a s t ə n
Fastenzeit;f a s t ə n ts aɪ t
Faszikel;f a s ts iː k ə l
Faulpelz;f aʊ l p ɛ l ts
Faun;f aʊ n
Faust;f aʊ s t
Faustfeuerwaffe;f aʊ s t f ɔʏ ɐ v a f ə
Fausthandschuh;f aʊ s t h a n t ʃ uː
Fäustling;f ɔʏ s t l ɪ ŋ
Fauxpas;f aʊ k s p a s
Favorit;f a v o r iː t
Fax;f a k s
Fazit;f aː ts ɪ t
Fechter;f ɛ ç t ɐ
Fechterin;f ɛ ç t ə r ɪ n
Federballspiel;f eː d ɐ b a l ʃ p iː l
Federchen;f eː d ɐ ç ə n
Federhalter;f eː d ɐ h a l t ɐ
Federspitz;f eː d ɐ ʃ p ɪ t s
Fee;f eː
Fegefeuer;f e ɡ ə f ɔʏ ɐ
Fehde;f eː d ə
Fehlbetrag;f eː l b ə t r aː k
Fehldeutung;f ə l d ɔʏ t ʊ ŋ
Fehlen;f eː l ə n
Fehlercode;f eː l ɐ k oː d ə
Fehlgriff;f ə l ɡ r ɪ f
Fehlschlag;f eː l ʃ l aː k
Fehlschluss;f eː l ʃ l ʊ s
Feierabend;f aɪ ɐ ʔ aː b ə n t
Feier;f aɪ ɐ
Feige;f aɪ ɡ ə
Feigenbaum;f aɪ ɡ ə n b aʊ m
Feigling;f aɪ k l ɪ ŋ
Feile;f aɪ l ə
Feindbild;f aɪ n t b ɪ l t
Feind;f aɪ n t
Feindin;f aɪ n d ɪ n
Feingehalt;f aɪ n ɡ ə h a l t
Feingehaltstempel;f aɪ n ɡ ə h a l t ʃ t ɛ m p ə l
Feinguss;f aɪ n ɡ ʊ s
Feinschmecker;f aɪ n ʃ m ɛ k ɐ
Feinschmeckerlokal;f aɪ n ʃ m ɛ k ɐ l n k aː l
Feinstaub;f aɪ n ʃ t aʊ p
Feinstruktur;f aɪ n s t r ʊ k t uːɐ ɐ
Feinstrukturkonstante;f aɪ n s t r ʊ k t ʊ r k ɔ n s t a n t ə
Feldbett;f ɛ l t b ɛ t
Feldforschung;f ɛ l t f ɔɐ z ɪ ç ʊ ŋ
Feldherr;f ɛ l t h ɛ r
Feldlinie;f ɛ l t l iː n j ə
Feldmaus;f ɛ l t m aʊ s
Feldmesser;f ɛ l t m ɛ s ɐ
Feldsalat;f ɛ l t z a l aː t
Feldspaten;f ɛ l t ʃ p aː t ə n
Feldspat;f ɛ l t s p a t
Feldversuch;f ɛ l t f ɐ z uː x
Feldzug;f ɛ l t t s uː k
Felge;f ɛ l ɡ ə
Felgenband;f ɛ l ɡ ə n b a n t
Felgenbremse;f ɛ l ɡ ə n b r ɛ m z ə
Fellache;f ɛ l a x ə
Fellachin;f ɛ l a x ɪ n
Fell;f ɛ l
Fellhandschuh;f ɛ l h a n t ʃ uː
Felsboden;f ɛ l s b oː d ə n
Felsenbirne;f ɛ l z ə n b ɪ ɐ n ə
Felsen;f ɛ l s ə n
Felsenpfeifer;f ɛ l s ʔ ɛ n p f aɪ f ɐ
Felsenpinguin;f ɛ l z ə n p ɪ ŋ ɡ u ɪ n
Fels;f ɛ l s
Feme;f ə m ə
Feminismus;f e m i n ɪ s m ʊ s
Feminist;f e m i n ɪ s t
Fenchel;f ɛ n ç ə l
Fennek;f ɛ n ə k
Fenn;f ɛ n
Fensterbrett;f ɛ n s t ɐ b r ɛ t
Fensterladen;f ɛ n s t ɐ l aː d ə n
Fensterrahmen;f ɛ n s t ɐ r aː m ə n
Fensterscheibe;f ɛ n s t ɐ ʃ aɪ b ə
Ferchromid;f ɛ r k r o m iː t
Ferkel;f ɛɐ k ə l
Fermate;f ɛɐ m øː aː t ə
Fermion;f ɛɐ m øː j oː n
Fermium;f ɛɐ m øː j ʊ m
Ferne;f ɛɐ n ə
Ferner;f ɛɐ n ɐ
Fernglas;f ɛɐ n ɡ ə l aː s
Fernsehapparat;f ɛɐ n z eː ʔ a p a r aː t
Fernsehbild;f ɛɐ n s z eː b ɪ l t
Fernsehgerät;f ɛɐ n z eː ɡ ə r ɛː t
Fernsehprediger;f ɛɐ n s z eː p r e d ɪ ɡ ɐ
Fernsehschirm;f ɛɐ n s z eː ʃ i r m
Fernsehsender;f ɛɐ n z eː s ɛ n d ɐ
Fernsehsendung;f ɛɐ n z eː z ɛ n d ʊ ŋ
Fernsprecher;f ɛɐ n s ʃ p r ɛ ç ɐ
Fernstudium;f ɛɐ n ʃ t uː d j ʊ m
Fernverkehr;f ɛɐ n f ɛɐ k eːɐ
Ferredoxin;f ɛɐ r e d ɔ k s iː n
Ferrit;f ɛɐ r ɪ t
Ferritin;f ɛɐ r i t iː n
Ferrocen;f ɛɐ r ɔ ts ə n
Ferromangan;f ɛɐ r oː m a ŋ ɡ aː n
Ferroniob;f ɛɐ r oː n dʒ oː p
Ferse;f ɛɐ z ə
Fertiggericht;f ɛɐ t ɪ ç ɡ ə r ɪ ç t
Fertighaus;f ɛɐ t ɪ ç h aʊ s
Fertigung;f ɛɐ t ɪ ɡ ʊ ŋ
Fessel;f ɛ s ə l
Fesselspiel;f ɛ s ə l ʃ p iː l
Festelektrolyt;f ɛ s t e l ɛ k t r oː l yː t
Festigkeit;f ɛ s t ɪ ç k aɪ t
Festival;f ɛ s t i v ə l
Festkörper;f ɛ s t k œɐ b p ɐ
Festnetz;f ɛ s t n ɛ t s
Feston;f ɛ s t ə n
Festspiel;f ɛ s t ʃ p iː l
Feststellung;f ɛ s t ʃ t ɛ l ʊ ŋ
Feststoff;f ɛ s t ʃ t ɔ f
Festung;f ɛ s t ʊ ŋ
Fettalkohol;f ɛ t aː l k o h oː l
Fett;f ɛ t
Fettleber;f ɛ t l eː b ɐ
Fettmolekül;f ɛ t t m o l ə k yː l
Fettsack;f ɛ t z a k
Fettsäure;f ɛ t s øː r ə
Fettwanst;f ɛ t v a n s t
Fetzen;f ɛ t s ə n
Feuchtigkeit;f ɔʏ ç t ɪ ç k aɪ t
Feuchtphase;f ɔʏ ç t f aː z ə
Feueralarm;f ɔʏ ɐ ʔ a l a r m
Feuerameise;f ɔʏ ə r a m aɪ z ə
Feuerbohne;f ɔʏ ɐ b oː n ə
Feuer;f ɔʏ ɐ
Feuerfisch;f ɔʏ ɐ f ɪ ʃ
Feuerkäfer;f ɔʏ ɐ k ɛː f ɐ
Feuerleiter;f ɔʏ ɐ l aɪ t ɐ
Feuerlöschmittel;f ɔʏ ɐ l œ ʃ m ɪ t ə l
Feuerprobe;f ɔʏ ɐ p r oː b ə
Feuertaufe;f ɔʏ ɐ t aʊ f ə
Feuerteufel;f ɔʏ ɐ t ɔʏ f ə l
Feuerturm;f ɔʏ ɐ t ʊɐ s m
Feuerwanze;f ɔʏ ɐ v a n ts ə
Feuerwehr;f ɔʏ ɐ v eːɐ
Feuerwehrfrau;f ɔʏ ɐ v eː r f r aʊ
Feuerwehrmann;f ɔʏ ɐ v eːɐ m a n
Feuerwerk;f ɔʏ ɐ v ɐ k
Feuerwerkskörper;f ɔʏ ɐ v ɐ k s k œɐ b p ɐ
Feuilleton;f ɔʏ l eː ɔ n
Fiasko;f i a s k o
Fichtelit;f ɪ ç t eː l ɪ t
Fichtenrüsselkäfer;f ɪ ç t ə n r ʏ s ə l k ɛː f ɐ
Fichtenspinner;f ɪ ç t ə n ʃ p ɪ n ɐ
Ficker;f ɪ k ɐ
Fick;f ɪ k
Fidjiralle;f iː d j i r a l ə
Fieberanfall;f iː b ɐ ʔ a n f a l
Fieber;f iː b ɐ
Fiebermittel;f iː b ɐ m ɪ t ə l
Fieberthermometer;f iː b ɐ t h ɐ m oː m eː t ɐ
Fiesling;f iː s l ɪ ŋ
Figur;f i ɡ uːɐ
Filet;f aɪ l ə t
Filmemacher;f ɪ l m ə m a x ɐ
Filmstar;f ɪ l m s t aː r
Filou;f iː l uː
Filterpapier;f ɪ l t ɐ p a p iː ə
Filtertüte;f ɪ l t ɐ t yː t ə
Filtrat;f ɪ l t r aː t
Filz;f ɪ l ts
Filzlaus;f ɪ l ts l aʊ s
Fimmel;f ɪ m ə l
Finale;f i n aː l ə
Financier;f aɪ n ɛ n iː ə
Finanzamt;f i n a n ts ʔ a m t
Finanzanleger;f i n a n ts a n l eː ɡ ɐ
Finanz;f i n a n ts
Finanzier;f i n a n ts iː ə
Finanzierung;f i n a n ts iː r ʊ ŋ
Finanzmarkt;f i n a n ts m a r k t
Finanzminister;f i n a n ts m i n ɪ s t ɐ
Finanzministerium;f i n a n ts m i n ɪ s t eːɐ j ʊ m
Findling;f ɪ n d l ɪ ŋ
Fingerabdruck;f ɪ ŋ ɐ ʔ a p d r ʊ k
Fingerfertigkeit;f ɪ ŋ ɐ f ɐ t ɪ ç k aɪ t
Fingerhakeln;f ɪ ŋ ɐ h aː k ə l n
Fingerhandschuh;f ɪ ŋ ɐ h a n t ʃ uː
Fingerhut;f ɪ ŋ ɐ h uː t
Fingerknöchel;f ɪ ŋ ɐ k n œ ç ə l
Fingernagel;f ɪ ŋ ɐ n aː ɡ ə l
Fingerspitze;f ɪ ŋ ɐ s p ɪ t s ə
Fingerspitzengefühl;f ɪ ŋ ɐ s p ɪ t s ə n ɡ ə f yː l
Fink;f ɪ ŋ k
Finnin;f ɪ n ɪ n
Finnländerin;f ɪ n l ɛ n d ə r ɪ n
Firmament;f ɪ r m a m ɛ n t
Firmenname;f ɪɐ m ə n n aː m ə
Firmensitz;f ɪ r m ə n z ɪ t s
Firmenstempel;f ɪ r m ɛ n ʃ t ɛ m p ə l
Firmung;f ɪɐ m ʊ ŋ
Firn;f ɪɐ n
Firnis;f ɪ ɐ n ɪ s
Fischadler;f ɪ ʃ aː t l ɐ
Fischbecken;f ɪ ʃ b ɛ k ə n
Fischbestand;f ɪ ʃ b ə ʃ t a n t
Fischer;f ɪ ʃ ɐ
Fischermarder;f ɪ ʃ ɐ m a r d ɐ
Fischhändler;f ɪ ʃ h ɛ n d l ɐ
Fischkatze;f ɪ ʃ k a t s ə
Fischmesser;f ɪ ʃ m ɛ s ɐ
Fischotter;f ɪ ʃ ɔ t ɐ
Fischstäbchen;f ɪ ʃ ʃ t ɛː p ç ə n
Fischtreppe;f ɪ ʃ t r ɛ p ə
Fischzucht;f ɪ ʃ ts ʊ x t
Fiskus;f ɪ s k ʊ s
Fitnessstudio;f ɪ t n ɛ s ʃ t uː d j o
Fixer;f ɪ k s ɐ
Fixierbad;f ɪ k s iː r b aː t
Fixiermittel;f ɪ k s iː r m ɪ t ə l
Fixiersalz;f ɪ k s j ɐ z a l ts
Fixpunkt;f ɪ k s p ʊ ŋ k t
Fixstern;f ɪ k s ʃ t ɐ n
Fläche;f l ɛ ç ə
Flachkopfkatze;f l a x k ɔ p f k a t s ə
Flachs;f l a k s
Fladenbrot;f l aː d ə n b r oː t
Fladen;f l aː d ə n
Flageolett;f l aː ɡ ə o l ɛ t
Flagge;f l aː ɡ ə
Flame;f l aː m ə
Flamingo;f l a m ɪ ŋ ɡ o
Flamme;f l a m ə
Flammschutzmittel;f l a m ʃ ʊ t s m ɪ t ə l
Flanell;f l aː n ɛ l
Flaneur;f l a n ɔʏ r
Flanke;f l a ŋ k ə
Fläschchen;f l ɛ ʃ ç ə n
Flasche;f l a ʃ ə
Flaschenhals;f l a ʃ ə n h a l s
Flaschenöffner;f l a ʃ ə n œ f n ɐ
Flash-back;f l ɛ ʃ b a k
Flashback;f l ɛ s b a k
Flaum;f l aʊ m
Flause;f l aʊ z ə
Flaute;f l aʊ t ə
Flechse;f l ɛ k s ə
Flechte;f l ɛ ç t ə
Fleckchen;f l ɛ k ç ə n
Fleckengesicht-Ameisenwürger;f l ɛ k ə n ɡ ə z ɪ ç t ʔ aː m aɪ z ə n v yː r ɡ ɐ
Fledermaus;f l eː d ɐ m aʊ s
Fleece;f l eː ts ə
Fleet;f l eː t
Flegel;f l eː ɡ ə l
Flehen;f l eː ə n
Fleischerei;f l aɪ ʃ ə r aɪ
Fleischer;f l aɪ ʃ ɐ
Fleischfresser;f l aɪ ʃ f r ɛ s ɐ
Fleischlaberl;f l aɪ ʃ l aː b ɐ l
Fleischsalat;f l aɪ ʃ z a l aː t
Fleischwunde;f l aɪ ʃ v ʊ n d ə
Flenser;f l ɛ n z ɐ
Fletschen;f l ɛ t ʃ ə n
Flexion;f l ɛ k s j oː n
Flicken;f l ɪ k ə n
Flickzeug;f l ɪ k ts ɔʏ k
Flieder;f l iː d ɐ
Fliegenpilz;f l iː ɡ ə n p ɪ l ts
Fliegerass;f l iː ɡ ə r aː s
Fliegerei;f l iː ɡ ə r aɪ
Flieger;f l iː ɡ ɐ
Fliese;f l iː z ə
Fließ;f l iː s
Fließgleichgewicht;f l iː s ɡ l aɪ ç ɡ ə v ɪ ç t
Fließtext;f l iː s t ɛ k s t
Flinte;f l ɪ n t ə
Flint;f l ɪ n t
Flipper;f l ɪ p ɐ
Flirt;f l œɐ t
Flittchen;f l ɪ t ç ə n
Flitter;f l ɪ t ɐ
Flitzer;f l ɪ t s ɐ
Flitzerin;f l ɪ t s ə r ɪ n
Flocke;f l ɔ k ə
Flohzirkus;f l oː ts i r k ʊ s
Florett;f l o r ɛ t
Flor;f l oː r
Floridaente;f l oː r iː d a e n t ə
Florist;f l o r ɪ s t
Floskel;f l ɔ s k ə l
Flosse;f l ɔ s ə
Flößer;f l øː s ɐ
Floß;f l oː s
Flöte;f l øː t ə
Flötenkonzert;f l øː t ə n k ɔ n ts ɐ t
Flötist;f l øː t ɪ s t
Flotte;f l ɔ t ə
Fluch;f l ʏ ç
Fluchtgeschwindigkeit;f l ʊ x t ɡ ə ʃ v ɪ n d ɪ ç k aɪ t
Flüchtigkeitsfehler;f l ʏ ç t ɪ ç k aɪ t s f eː l ɐ
Flüchtling;f l ʏ ç t l ɪ ŋ
Flüchtlingzelt;f l ʏ ç t l ɪ ŋ ts ɛ l t
Flugbegleiter;f l uː k b ə ɡ l aɪ t ɐ
Flugbenzin;f l uː k b ɛ n ts iː n
Flugblatt;f l uː k b l a t
Flügelfläche;f l yː ɡ ə l f l ɛ ç ə
Flügel;f l yː ɡ ə l
Flügelhorn;f l yː ɡ ə l h ɔɐ n t
Flug;f l uː k
Fluggesellschaft;f l uː k ɡ ə z ɛ l ʃ a f t
Flughörnchen;f l uː ɡ œɐ n t ç ə n
Flugkapitän;f l uː k k a p i t ɛː n
Flugkorridor;f l uː k k ɔ r i d ɔ r
Fluglinie;f l uː k l iː n j ə
Flugplatz;f l uː k p l a t s
Flugschreiber;f l uː k ʃ r aɪ b ɐ
Flugstaub;f l uː k s t ʔ aʊ p
Flugtauglichkeit;f l uː k t ʔ aʊ ɡ l ɪ ç k aɪ t
Flugzeugmutterschiff;f l uː k ts ɔʏ k m ʊ t ɐ ʃ ɪ f
Flugzeugträger;f l uː k ts ɔʏ k t r ɛː ɡ ɐ
Flugzeugtriebwerk;f l uː k ts ɔʏ k t r iː p v ɐ k
Fluid;f l uː ɪ t
Fluidität;f l uː n d i t ɛː t
Flunder;f l ʊ n d ɐ
Fluoracetat;f l uː o r a aɪ s t aː t
Fluorapatit;f l u o r a p a t i t
Fluoratom;f l u o r a t oː m
Fluorcarbon;f l u ʔ ɔ r k a r b oː n
Fluorchlorkohlenwasserstoff;f l u ʔ ɔ r ç l ɔɐ k ə oː l ə n v a s ɐ ʃ t ɔ f
Fluorcitrat;f l u ʔ ɔ r s ɪ t r aː t
Fluoreszenzfarbstoff;f l uː o r ɛ s ts ɛ n ts f a r p ʃ t ɔ f
Fluoreszenz;f l uː o r ɛ s ts ɛ n ts
Fluorgehalt;f l u ʔ ɔ r ɡ ə h a l t
Fluorid;f l uː o r iː t
Fluoridierung;f l uː o r i d iː r ʊ ŋ
Fluorierung;f l u o r iː r ʊ ŋ
Fluorierungsmittel;f l u o r iː r ʊ ŋ s m ɪ t ə l
Fluorit;f l u o r ɪ t
Fluoritkristall;f l u o r i t k r iː s t a l
Fluorkohlenwasserstoff;f l u ʔ ɔ r k oː l ə n v a s ɐ ʃ t ɔ f
Fluorohydrid;f l u o r o h aɪ d r ɪ t
Fluorradikal;f l u oːɐ r a d i k aː l
Fluorsalz;f l u ʔ ɔ ɐ s ʔ a l ts
Fluse;f l uː z ə
Flussbarsch;f l ʊ s b a r ʃ
Flussbett;f l ʊ s b ɛ t
Fluss;f l ʊ s
Fluß;f l ʊ s
Flüssiggas;f l ʏ s ɪ ç ɡ aː s
Flüssigkristallbildschirm;f l ʏ s ɪ ç k r ɪ s t a l b ɪ l t ʃ i r m
Flüssigkristall;f l ʏ s ɪ ç k r ɪ s t a l
Flüssigtreibstoff;f l ʏ s ɪ ç t r aɪ p ʃ t ɔ f
Flusssäure;f l ʊ s ɔʏ r ə
Flusssediment;f l ʊ s ə d i m ɛ n t
Flussspat;f l ʊ s p a t
Flussufer;f l ʊ s uː f ɐ
Flusswasser;f l ʊ s v a s ɐ
Flut;f l uː t
Fohlen;f oː l ə n
Föhn;f øː n
Föhre;f øː r ə
Fokus;f oː k ʊ s
Folge;f ɔ l ɡ ə
Foliensatz;f oː l j ə n z a t s
Folter;f ɔ l t ɐ
Folterknecht;f ɔ l t ɐ k n ɛ ç t
Fondue;f ɔ n d ʏ
Fonem;f ɔ n ə m
Fön;f øː n
Football;f ʊ t b ɔ l
Förde;f øː r d ə
Förderland;f øː r d ɐ l a n t
Forderung;f ɔɐ d ə r ʊ ŋ
Forke;f oːɐ r k ə
Formant;f ɔɐ m a ʔ a n t
Format;f ɔɐ m aː t
Formatierung;f ɔɐ m a ts t iː r ʊ ŋ
Formel;f ɔɐ m ə l
Form;f ɔɐ m
Formiat;f ɔɐ m a i a t
Formular;f ɔɐ m u l aː r
Forscher;f ɔɐ ʃ ɐ
Forschung;f ɔɐ ʃ ʊ ŋ
Forschungsanlage;f ɔɐ z ɪ ç ʊ ŋ s ʔ a n l aː ɡ ə
Forschungsgegenstand;f ɔɐ z ɪ ç ʊ ŋ s ɡ eː ɡ ə n ʃ t a n t
Forschungslabor;f ɔɐ z ɪ ç ʊ ŋ s l a b ɔ r
Forschungszentrum;f ɔɐ z ɪ ç ʊ ŋ s ts ɛ n t r ʊ m
Förster;f œɐ s t ɐ
Försterin;f œɐ z ɪ t ə r ɪ n
Forstwirtschaft;f ɔɐ s t v ɪɐ t ʃ a f t
Fort;f ɔɐ t
Fortgang;f ɔɐ t ɡ a ŋ
Fortkommen;f ɔɐ t s k ɔ m ə n
Fortsetzung;f ɔɐ t z ɛ t s ʊ ŋ
Forum;f oː r ʊ m
Fotoalbum;f oː t o ʔ a l b ʊ m
Fotoapparat;f oː t o ʔ a p a r aː t
Fotoempfänger;f oː t o eː m p f ɛ ŋ ɐ
Foto;f oː t o
Fotogenität;f oː t o ɡ ə n i t ɛː t
Fotograf;f o t o ɡ r aː f
Fotografin;f o t o ɡ r aː f iː n
Fotokopierer;f oː t o k o p iː r ɐ
Fotopapier;f o t o p a p iː ə
Fotosynthese;f oː t o z ʏ n t eː z ə
Fotovervielfacher;f oː t oː v ɐ f iː l f a x ɐ
Fotze;f ɔ t s ə
Foyer;f o a j eː
Fracht;f r a x t
Frachtschiff;f r a x t ʃ ɪ f
Frack;f r a k
Fragebogen;f r aː ɡ ə b oː ɡ ə n
Fragenkatalog;f r aː ɡ ə n k a t a l oː k
Fragerei;f r aː ɡ ə r aɪ
Fraktal;f r a k t aː l
Fraktionschef;f r a k ts j oː n s ʃ ɛ f
Fraktur;f r a k t uːɐ ɐ
Franc;f r aː
Franchise;f r a n ç i z ə
Franke;f r a ŋ k ə
Franzose;f r a n ts oː z ə
Französin;f r a n ts øː z ɪ n
Fräser;f r ɛː z ɐ
Fräsmaschine;f r ɛ s m a ʃ iː n ə
Fraß;f r aː s
Frater;f r aː t ɐ
Frauenzimmer;f r aʊ ə n ts ɪ m ɐ
Fräulein;f r ɔʏ l aɪ n
Fraw;f r aː f
Freak;f r e a k
Frechdachs;f r ɛ ç d a x s
Freeganer;f r eː ɡ aː n ɐ
Fregatte;f r e ɡ a t ə
Freibad;f r aɪ b aː t
Freibergit;f r aɪ b ɐ ɡ ɪ t
Freiberufler;f r aɪ b ə r uː f l ɐ
Freibeuter;f r aɪ b ə ʔ u t ɐ
Freibrief;f r aɪ b r iː f
Freiburger;f r aɪ b t r ɡ ɐ
Freier;f r aɪ ɐ
Freihandel;f r aɪ h a n d ə l
Freiheit;f r aɪ h aɪ t
Freiherr;f r aɪ h ɛɐ
Freiin;f r aɪ ɪ n
Freilichtmuseum;f r aɪ l ɪ ç t m u z eː ʊ m
Freimaurer;f r aɪ m aʊ r ɐ
Freisetzung;f r aɪ z ɛ t s ʊ ŋ
Freispruch;f r aɪ ʃ p r ʊ x
Freistaat;f r aɪ ʃ t aː t
Freistoß;f r aɪ s t oː s
Freitagabend;f r aɪ t aː k ʔ aː b ə n t
Freitagmittag;f r aɪ t aː k m ɪ t aː k
Freitagnachmittag;f r aɪ t aː k n aː x m ɪ t aː k
Freitagvormittag;f r aɪ t aː k f oːɐ r m ɪ t aː k
Freitod;f r aɪ t oː t
Freizeit;f r aɪ ts aɪ t
Freizeitpark;f r aɪ ts aɪ t p a r k
Freizeitzentrum;f r aɪ ts aɪ t t s ɛ n t r ʊ m
Fremdatom;f r ɛ m d a t oː m
Fremdbestandteil;f r ɛ m t b ə ʃ t a n t t aɪ l
Fremdenverkehr;f r ɛ m d ə n f ɐ k eː r
Fremdkapital;f r ɛ m t k a p i t aː l
Fremdkörper;f r ɛ m t k œɐ p ɐ
Fremdscham;f r ɛ m t ʃ aː m
Fremdsprache;f r ɛ m t ʃ p r aː x ə
Fremdstoff;f r ɛ m t ʃ t ɔ f
Fremdwährung;f r ɛ m t v ɛː r ʊ ŋ
Fremdwort;f r ɛ m t v ɔɐ t
Frequenzbereich;f r e k v ɛ n ts b ə r aɪ ç
Freske;f r ɛ s k ə
Fresko;f r ɛ s k o
Fresse;f r ɛ s ə
Fressfeind;f r ɛ s f aɪ n t
Frettchen;f r ɛ t ç ə n
Freude;f r ɔʏ d ə
Freudenhaus;f r ɔʏ d ə n h aʊ s
Freudentaumel;f r ɔʏ d ə n t ʔ aʊ m ə l
Freundchen;f r ɔʏ n t ç ə n
Freund;f r ɔʏ n t
Freundin;f r ɔʏ n d ɪ n
Freundlichkeit;f r ɔʏ n t l ɪ ç k aɪ t
Frevel;f r e v ə l
Friedensforscher;f r iː d ə n s f ɔɐ z ɪ ç ɐ
